{"@context":["https://www.w3.org/ns/did/v1","https://w3id.org/security/suites/jws-2020/v1"],"id":"did:web:tng-cdn-dev.who.int:v2:trustlist:DCC:SUR","controller":"did:web:tng-cdn-dev.who.int:v2:trustlist:DCC","verificationMethod":[{"id":"did:web:tng-cdn-dev.who.int:v2:trustlist:DCC:SUR:DSC#YZITJd3wXg4=","type":"JsonWebKey2020","controller":"did:web:tng-cdn-dev.who.int:v2:trustlist:DCC","publicKeyJwk":{"kty":"EC","kid":"YZITJd3wXg4=","x5c":["MIICgjCCAiigAwIBAgIUZM+yU5yfMFIutUt5isWQAQSrKOAwCgYIKoZIzj0EAwIwfTELMAkGA1UEBhMCU1IxEDAOBgNVBAgMB1N1cmluYW0xHTAbBgNVBAcMFExBQ1Bhc3MgQ29ubmVjdGF0aG9uMQwwCgYDVQQKDANXSE8xDDAKBgNVBAsMA1ImRDEhMB8GA1UEAwwYTEFDUGFzcyBDb25uZWN0YXRob24gVE5HMB4XDTIzMTAzMDIxMDg1MVoXDTI1MTAyOTIxMDg1MVowRTELMAkGA1UEBhMCU1IxEzARBgNVBAgMClNvbWUtU3RhdGUxITAfBgNVBAoMGEludGVybmV0IFdpZGdpdHMgUHR5IEx0ZDBZMBMGByqGSM49AgEGCCqGSM49AwEHA0IABGofjK0DVbAyWZGKi+N/XX9d0XcyREqqiuPdIKroEZTzmeovQ5ycFJNqC9awuoDKYSHv0ypieIfLa9gnzdtPoyCjgb0wgbowDgYDVR0PAQH/BAQDAgKEMB0GA1UdDgQWBBTWMgofRdUC/Ox4B1I4/QPqPdRYCzAfBgNVHSMEGDAWgBQz8F/l19jf31pHrawrimNN8JTZmzA2BgNVHR8ELzAtMCugKaAnhiVodHRwOi8vbGFjcGFzcy5yYWNzZWwub3JnL0NSTC9TQ0EuY3JsMDAGA1UdJQQpMCcGCysGAQQBjjePZQEBBgsrBgEEAY43j2UBAgYLKwYBBAGON49lAQMwCgYIKoZIzj0EAwIDSAAwRQIhAMV66z6zrV5GvLpgA2CJVM2U3sfdJyyi7ZfcqFqSegHPAiBDoVoYygvp+/54JftOYCgSxLa27L87la6jUBhSJCyB7A=="],"crv":"P-256","x":"ah-MrQNVsDJZkYqL439df13RdzJESqqK490gqugRlPM","y":"AJnqL0OcnBSTagvWsLqAymEh79MqYniHy2vYJ83bT6Mg"}}],"proof":{"type":"JsonWebSignature2020","created":"2025-02-24T12:00:08Z","nonce":"6w0TOtHDAhULPNGsSLGRiVXCX7neHwBR","proofPurpose":"assertionMethod","verificationMethod":"did:web:raw.githubusercontent.com:WorldHealthOrganization:tng-participants-dev:main:WHO:signing:DID","jws":"eyJiNjQiOmZhbHNlLCJjcml0IjpbImI2NCJdLCJhbGciOiJFUzI1NiJ9..MEUCIAG7imw1YZfa7raRP5ErVyes57tmjTTNga5qBeAc8pH0AiEAoc-MnL2vrCTElUJgCXlpq9Gv56hXtRm4VaQ0Oqtx5bo"}}