{"@context":["https://www.w3.org/ns/did/v1","https://w3id.org/security/suites/jws-2020/v1"],"id":"did:web:worldhealthorganization.github.io:tng-cdn-dev:v2.0.0:trustlist:DCC:URY:DSC:RVRDQmNaa0VyVHM9","controller":"did:web:worldhealthorganization.github.io:tng-cdn-dev:v2.0.0:trustlist:DCC:URY:DSC:RVRDQmNaa0VyVHM9","verificationMethod":[{"id":"did:web:worldhealthorganization.github.io:tng-cdn-dev:v2.0.0:trustlist:DCC:URY:DSC:RVRDQmNaa0VyVHM9","type":"JsonWebKey2020","controller":"did:web:worldhealthorganization.github.io:tng-cdn-dev:v2.0.0:trustlist:DCC:URY:DSC:RVRDQmNaa0VyVHM9","publicKeyJwk":{"kty":"EC","kid":"RVRDQmNaa0VyVHM9","x5c":["MIICgzCCAiigAwIBAgIUW84kkm3u4yNVzH+1BdfjWVUW+80wCgYIKoZIzj0EAwIwfTELMAkGA1UEBhMCVVkxEDAOBgNVBAgMB1VydWd1YXkxHTAbBgNVBAcMFExBQ1Bhc3MgQ29ubmVjdGF0aG9uMQwwCgYDVQQKDANXSE8xDDAKBgNVBAsMA1ImRDEhMB8GA1UEAwwYTEFDUGFzcyBDb25uZWN0YXRob24gVE5HMB4XDTIzMTAzMDIwNDM1OVoXDTI1MTAyOTIwNDM1OVowRTELMAkGA1UEBhMCVVkxEzARBgNVBAgMClNvbWUtU3RhdGUxITAfBgNVBAoMGEludGVybmV0IFdpZGdpdHMgUHR5IEx0ZDBZMBMGByqGSM49AgEGCCqGSM49AwEHA0IABMunTGuCn/39AyhdZyStLWiC07Ase6wotKegYMPKBp6k1tKUu/S2MAICINZDFCnVNUIQ76ZzbGiEKA9No2A6Aumjgb0wgbowDgYDVR0PAQH/BAQDAgKEMB0GA1UdDgQWBBSopxkbAHqjkFqhoHTZo+mOcoXF2DAfBgNVHSMEGDAWgBTAFgtQnNmNy5gJHGtN1sBgdgqM2DA2BgNVHR8ELzAtMCugKaAnhiVodHRwOi8vbGFjcGFzcy5yYWNzZWwub3JnL0NSTC9TQ0EuY3JsMDAGA1UdJQQpMCcGCysGAQQBjjePZQEBBgsrBgEEAY43j2UBAgYLKwYBBAGON49lAQMwCgYIKoZIzj0EAwIDSQAwRgIhAPPtkaIZ6qmUtj1LgXa8b5WQc2z8qSbYpAJCIdm5BzYeAiEAi/bHbvNc2yeRZmaReNYOS0LGomamYBKkwsuHhE+19pA="],"crv":"P-256","x":"AMunTGuCn_39AyhdZyStLWiC07Ase6wotKegYMPKBp6k","y":"ANbSlLv0tjACAiDWQxQp1TVCEO-mc2xohCgPTaNgOgLp"}}],"proof":{"type":"JsonWebSignature2020","created":"2024-09-27T15:36:07Z","nonce":"xV2mVqxjdcZ7y44MREszloUbAxQ2gLze","proofPurpose":"assertionMethod","verificationMethod":"did:web:raw.githubusercontent.com:WorldHealthOrganization:tng-participants-dev:main:WHO:signing:DID","jws":"eyJiNjQiOmZhbHNlLCJjcml0IjpbImI2NCJdLCJhbGciOiJFUzI1NiJ9..MEUCIQD2K-14_ateiATr75-5ul0ust_w799RY7C4KNzZ24IA2gIgRPW03_ef2NhU8Exyk3By-x1PVKA6tVB_ZRPLa7cLYRY"}}