{"@context":["https://www.w3.org/ns/did/v1","https://w3id.org/security/suites/jws-2020/v1"],"id":"did:web:tng-cdn-dev.who.int:v2:trustlist:PH4H:XK","controller":"did:web:tng-cdn-dev.who.int:v2:trustlist:PH4H","verificationMethod":[{"id":"did:web:tng-cdn-dev.who.int:v2:trustlist:PH4H:XK:DSC#ZCaWOjJe9RY=","type":"JsonWebKey2020","controller":"did:web:tng-cdn-dev.who.int:v2:trustlist:PH4H","publicKeyJwk":{"kty":"EC","kid":"ZCaWOjJe9RY=","x5c":["MIICiDCCAi6gAwIBAgIUKZm5x8yN7VRlllxyUcO+BhQPfoowCgYIKoZIzj0EAwIwaDELMAkGA1UEBhMCWEsxETAPBgNVBAgMCFhYSyBUZXN0MQ4wDAYDVQQHDAVSZW5nbzENMAsGA1UECgwEQ0VOUzEMMAoGA1UECwwDSU5UMRkwFwYDVQQDDBBOYXRpb25YQV9UTlBfU0NBMB4XDTI0MTAwMjE1MzU0NloXDTI2MTAwMjE1MzU0NlowczELMAkGA1UEBhMCWEsxETAPBgNVBAgMCFhYSyBUZXN0MQ4wDAYDVQQHDAVSZW5nbzENMAsGA1UECgwEQ0VOUzEMMAoGA1UECwwDSU5UMSQwIgYDVQQDDBtIZWFsdGggQWRtaW5pc3RyYXRpb24gb2YgWEEwWTATBgcqhkjOPQIBBggqhkjOPQMBBwNCAATk8oZ0Ge2w9mGo7FrTcng3Hiz7LpWTiPH+r+cCPJLmhbC06okKBgv/dLI2RVwdGMf5NofyM7ONPxwCNuhUfR0oo4GqMIGnMA4GA1UdDwEB/wQEAwIHgDAdBgNVHQ4EFgQU7qSdfamN+IbLxcUrt5WvRQjNmawwHwYDVR0jBBgwFoAUsmd2OpfraYwhKdRo5NSPNmLz+44wPQYDVR0fBDYwNDAyoDCgLoYsaHR0cDovL2NybC5leGFtcGxlZG9tYWluLmV4YW1wbGUvQ1JML1NDQS5jcmwwFgYDVR0lBA8wDQYLKwYBBAGON49lAQEwCgYIKoZIzj0EAwIDSAAwRQIhAIM53GDoIdRskagsbhPjPeIdr/vgqPftqK23/amBdeBoAiAUpoVa4WIknHMSpdF9Og676jGM13FZ8RA51vbp+6Kyxg==","MIICGDCCAb2gAwIBAgIUJB6VcPED/0CbJHX1DYSaB+lZ2Y8wCgYIKoZIzj0EAwIwaDELMAkGA1UEBhMCWEsxETAPBgNVBAgMCFhYSyBUZXN0MQ4wDAYDVQQHDAVSZW5nbzENMAsGA1UECgwEQ0VOUzEMMAoGA1UECwwDSU5UMRkwFwYDVQQDDBBOYXRpb25YQV9UTlBfU0NBMB4XDTI0MTAwMjEzMzczMVoXDTI4MTAwMjEzMzczMVowaDELMAkGA1UEBhMCWEsxETAPBgNVBAgMCFhYSyBUZXN0MQ4wDAYDVQQHDAVSZW5nbzENMAsGA1UECgwEQ0VOUzEMMAoGA1UECwwDSU5UMRkwFwYDVQQDDBBOYXRpb25YQV9UTlBfU0NBMFkwEwYHKoZIzj0CAQYIKoZIzj0DAQcDQgAETabv6ZKI3IvJY+YRrAYE5OD2nmeCPepGPqRVKXufAnFJSmqY56Rm9438LB/MA0RGZxhJgfv8aO2fTgq/iFQqzaNFMEMwEgYDVR0TAQH/BAgwBgEB/wIBADAOBgNVHQ8BAf8EBAMCAQYwHQYDVR0OBBYEFLJndjqX62mMISnUaOTUjzZi8/uOMAoGCCqGSM49BAMCA0kAMEYCIQC49mQ2OVOiDbmwhuJJCMd/ZuSc++7h6g2qunSBBc+RpgIhAJnOehvIrmD22OE43gdh5A6zDaZ/k+ZXgGywFq+WZSV7"],"crv":"P-256","x":"AOTyhnQZ7bD2YajsWtNyeDceLPsulZOI8f6v5wI8kuaF","y":"ALC06okKBgv_dLI2RVwdGMf5NofyM7ONPxwCNuhUfR0o"}},{"id":"did:web:tng-cdn-dev.who.int:v2:trustlist:PH4H:XK:SCA#yI/KhCmzVnw=","type":"JsonWebKey2020","controller":"did:web:tng-cdn-dev.who.int:v2:trustlist:PH4H","publicKeyJwk":{"kty":"EC","kid":"yI/KhCmzVnw=","x5c":["MIICGDCCAb2gAwIBAgIUJB6VcPED/0CbJHX1DYSaB+lZ2Y8wCgYIKoZIzj0EAwIwaDELMAkGA1UEBhMCWEsxETAPBgNVBAgMCFhYSyBUZXN0MQ4wDAYDVQQHDAVSZW5nbzENMAsGA1UECgwEQ0VOUzEMMAoGA1UECwwDSU5UMRkwFwYDVQQDDBBOYXRpb25YQV9UTlBfU0NBMB4XDTI0MTAwMjEzMzczMVoXDTI4MTAwMjEzMzczMVowaDELMAkGA1UEBhMCWEsxETAPBgNVBAgMCFhYSyBUZXN0MQ4wDAYDVQQHDAVSZW5nbzENMAsGA1UECgwEQ0VOUzEMMAoGA1UECwwDSU5UMRkwFwYDVQQDDBBOYXRpb25YQV9UTlBfU0NBMFkwEwYHKoZIzj0CAQYIKoZIzj0DAQcDQgAETabv6ZKI3IvJY+YRrAYE5OD2nmeCPepGPqRVKXufAnFJSmqY56Rm9438LB/MA0RGZxhJgfv8aO2fTgq/iFQqzaNFMEMwEgYDVR0TAQH/BAgwBgEB/wIBADAOBgNVHQ8BAf8EBAMCAQYwHQYDVR0OBBYEFLJndjqX62mMISnUaOTUjzZi8/uOMAoGCCqGSM49BAMCA0kAMEYCIQC49mQ2OVOiDbmwhuJJCMd/ZuSc++7h6g2qunSBBc+RpgIhAJnOehvIrmD22OE43gdh5A6zDaZ/k+ZXgGywFq+WZSV7"],"crv":"P-256","x":"Tabv6ZKI3IvJY-YRrAYE5OD2nmeCPepGPqRVKXufAnE","y":"SUpqmOekZveN_CwfzANERmcYSYH7_Gjtn04Kv4hUKs0"}}],"proof":{"type":"JsonWebSignature2020","created":"2024-12-08T06:00:09Z","nonce":"HbuGyknu1lWOZFc8DRjxo0AfVWwJjIub","proofPurpose":"assertionMethod","verificationMethod":"did:web:raw.githubusercontent.com:WorldHealthOrganization:tng-participants-dev:main:WHO:signing:DID","jws":"eyJiNjQiOmZhbHNlLCJjcml0IjpbImI2NCJdLCJhbGciOiJFUzI1NiJ9..MEYCIQCaeW_VRpJrlQxcZoBap7n7DPK4_XlIFm1Slj75cSBuMgIhAIB_LU9vAT0exGBIVMlYs7p1ypZLGm-ukwJaRKeNncXS"}}