{"@context":["https://www.w3.org/ns/did/v1","https://w3id.org/security/suites/jws-2020/v1"],"id":"did:web:worldhealthorganization.github.io:tng-cdn-dev:v2.0.0:trustlist:DCC:-:SCA:NWlkQTZuQ1ZkY3M9","controller":"did:web:worldhealthorganization.github.io:tng-cdn-dev:v2.0.0:trustlist:DCC:-:SCA:NWlkQTZuQ1ZkY3M9","verificationMethod":[{"id":"did:web:worldhealthorganization.github.io:tng-cdn-dev:v2.0.0:trustlist:DCC:-:SCA:NWlkQTZuQ1ZkY3M9","type":"JsonWebKey2020","controller":"did:web:worldhealthorganization.github.io:tng-cdn-dev:v2.0.0:trustlist:DCC:-:SCA:NWlkQTZuQ1ZkY3M9","publicKeyJwk":{"kty":"EC","kid":"NWlkQTZuQ1ZkY3M9","x5c":["MIICMTCCAdagAwIBAgIIZlnLX4lvKncwCgYIKoZIzj0EAwIwZDELMAkGA1UEBhMCWEExGDAWBgNVBAgTD1Rlc3QgQ291bnRyeSBYQTElMCMGA1UEChMcVC1TeXN0ZW1zIEludGVybmF0aW9uYWwgR21iSDEUMBIGA1UECxMLVGVzdCBJc3N1ZXIwHhcNMjMwNTIyMDkwOTAwWhcNMzMwNTIyMDkwOTAwWjBkMQswCQYDVQQGEwJYQTEYMBYGA1UECBMPVGVzdCBDb3VudHJ5IFhBMSUwIwYDVQQKExxULVN5c3RlbXMgSW50ZXJuYXRpb25hbCBHbWJIMRQwEgYDVQQLEwtUZXN0IElzc3VlcjBZMBMGByqGSM49AgEGCCqGSM49AwEHA0IABD4iOqn+R392jZ8IJT7oBPIwVkqPw6CHSiiIjbt551DzyoGPcY08DcK2pyWxmyEggAT7ESHmhAsGCWq7oCxxDgejcjBwMA8GA1UdEwEB/wQFMAMBAf8wHQYDVR0OBBYEFJ0FiftByPLKqAkZjdvtot+8edqCMAsGA1UdDwQEAwIBBjARBglghkgBhvhCAQEEBAMCAAcwHgYJYIZIAYb4QgENBBEWD3hjYSBjZXJ0aWZpY2F0ZTAKBggqhkjOPQQDAgNJADBGAiEAnyiCT+1y2BakWOTXu7bx8thC8qgJNR58L/79Zq/pLQACIQDSanlXj77uym+OBbopRP5fbxh7W0EUSnh+H5m2dGGxXQ=="],"crv":"P-256","x":"PiI6qf5Hf3aNnwglPugE8jBWSo_DoIdKKIiNu3nnUPM","y":"AMqBj3GNPA3CtqclsZshIIAE-xEh5oQLBglqu6AscQ4H"}}],"proof":{"type":"JsonWebSignature2020","created":"2024-09-27T15:36:13Z","nonce":"cln0CcGvXZbggWPINaHkb3ENjswXcrs1","proofPurpose":"assertionMethod","verificationMethod":"did:web:raw.githubusercontent.com:WorldHealthOrganization:tng-participants-dev:main:WHO:signing:DID","jws":"eyJiNjQiOmZhbHNlLCJjcml0IjpbImI2NCJdLCJhbGciOiJFUzI1NiJ9..MEYCIQC_S89CnHfkImgPX8Qj0Nwfz4jgy-RjNHhZtjpkkKLA9wIhAN1MeSqSOMqIuZRhQr9CsE3ihXCNCBRNN75fReQPYYgl"}}