{"@context":["https://www.w3.org/ns/did/v1","https://w3id.org/security/suites/jws-2020/v1"],"id":"did:web:worldhealthorganization.github.io:tng-cdn-dev:v2.0.0:trustlist:DCC:SGP:DSC:YjkwNmxmakFqSnc9","controller":"did:web:worldhealthorganization.github.io:tng-cdn-dev:v2.0.0:trustlist:DCC:SGP:DSC:YjkwNmxmakFqSnc9","verificationMethod":[{"id":"did:web:worldhealthorganization.github.io:tng-cdn-dev:v2.0.0:trustlist:DCC:SGP:DSC:YjkwNmxmakFqSnc9","type":"JsonWebKey2020","controller":"did:web:worldhealthorganization.github.io:tng-cdn-dev:v2.0.0:trustlist:DCC:SGP:DSC:YjkwNmxmakFqSnc9","publicKeyJwk":{"kty":"EC","kid":"YjkwNmxmakFqSnc9","x5c":["MIICpzCCAk2gAwIBAgIBCjAKBggqhkjOPQQDAjCBnjELMAkGA1UEBhMCU0cxEjAQBgNVBAgMCVNpbmdhcG9yZTESMBAGA1UEBwwJU2luZ2Fwb3JlMSUwIwYDVQQKDBxHb3Zlcm5tZW50IFRlY2hub2xvZ3kgQWdlbmN5MSUwIwYDVQQLDBxHb3Zlcm5tZW50IFRlY2hub2xvZ3kgQWdlbmN5MRkwFwYDVQQDDBBOYXRpb25TR19UTlBfU0NBMB4XDTI0MDExNjA0MzMxMVoXDTI2MDExNTA0MzMxMVowWzELMAkGA1UEBhMCU0cxEjAQBgNVBAgMCVNpbmdhcG9yZTEbMBkGA1UECgwSTWluaXN0cnkgb2YgSGVhbHRoMRswGQYDVQQDDBJkc2MuZGV2Lm1vaC5nb3Yuc2cwWTATBgcqhkjOPQIBBggqhkjOPQMBBwNCAATBqZV36iduWES4BcB7sAoVHG9/8DSNzsqzAz5QFzWHdBWhUqnD26c+I5NMByOUq2pcDkM8zpPR/dPNjPS9aA8Mo4G9MIG6MA4GA1UdDwEB/wQEAwIHgDAdBgNVHQ4EFgQUSVf1YIJEC+/oIeFADIu0XFwQHFgwHwYDVR0jBBgwFoAUExwIKlJkqmoaReu01zmHLRa3bp4wNgYDVR0fBC8wLTAroCmgJ4YlaHR0cHM6Ly9kZXYubm90YXJpc2UuaW8vY3JsbnVtYmVyLmxvZzAwBgNVHSUEKTAnBgsrBgEEAY43j2UBAQYLKwYBBAGON49lAQIGCysGAQQBjjePZQEDMAoGCCqGSM49BAMCA0gAMEUCIQCcKNh+t4qgCcj/ClXIq05Bk6/gCsA+RJ7IHqNMlRZr4QIge5ERon+yTtUhy2GuHfg9z+4wdMQPThi/98fGGFVNUgw=","MIIChTCCAiugAwIBAgIUJGay9EmJvH4HKEASN+E/l8a2gsAwCgYIKoZIzj0EAwIwgZ4xCzAJBgNVBAYTAlNHMRIwEAYDVQQIDAlTaW5nYXBvcmUxEjAQBgNVBAcMCVNpbmdhcG9yZTElMCMGA1UECgwcR292ZXJubWVudCBUZWNobm9sb2d5IEFnZW5jeTElMCMGA1UECwwcR292ZXJubWVudCBUZWNobm9sb2d5IEFnZW5jeTEZMBcGA1UEAwwQTmF0aW9uU0dfVE5QX1NDQTAeFw0yNDAxMTEwODU3MDVaFw0yODAxMTEwODU3MDVaMIGeMQswCQYDVQQGEwJTRzESMBAGA1UECAwJU2luZ2Fwb3JlMRIwEAYDVQQHDAlTaW5nYXBvcmUxJTAjBgNVBAoMHEdvdmVybm1lbnQgVGVjaG5vbG9neSBBZ2VuY3kxJTAjBgNVBAsMHEdvdmVybm1lbnQgVGVjaG5vbG9neSBBZ2VuY3kxGTAXBgNVBAMMEE5hdGlvblNHX1ROUF9TQ0EwWTATBgcqhkjOPQIBBggqhkjOPQMBBwNCAAQbloxs5hnyUNmiUAEalnyHvp5/xRMjvJhqpFZnGCVwgWQk/V3rZgKFalOD2f4h6NYkdEtT+vbsyVRCYQ6gLs7uo0UwQzASBgNVHRMBAf8ECDAGAQH/AgEAMA4GA1UdDwEB/wQEAwIBBjAdBgNVHQ4EFgQUExwIKlJkqmoaReu01zmHLRa3bp4wCgYIKoZIzj0EAwIDSAAwRQIgPHzgalbUqvAWaICwaGkwKqEeqOYeXqH64fEdAOBrr3wCIQC+PMcEi7lmW2dih8Xw993at8b0Cc5NRBQs9b9nar70fw=="],"crv":"P-256","x":"AMGplXfqJ25YRLgFwHuwChUcb3_wNI3OyrMDPlAXNYd0","y":"FaFSqcPbpz4jk0wHI5SralwOQzzOk9H9082M9L1oDww"}}],"proof":{"type":"JsonWebSignature2020","created":"2024-09-27T15:36:07Z","nonce":"j7YO36ftpZaHlrspLt0DmZQPCXlGAFUJ","proofPurpose":"assertionMethod","verificationMethod":"did:web:raw.githubusercontent.com:WorldHealthOrganization:tng-participants-dev:main:WHO:signing:DID","jws":"eyJiNjQiOmZhbHNlLCJjcml0IjpbImI2NCJdLCJhbGciOiJFUzI1NiJ9..MEYCIQDows4LwCthXKgBTBRFwEtK_lxpU8DBdfv31wogc_3gjQIhANK6Top7zm31miLpTHS8SDiIMeA_MFMAfSEw-hS3N7tu"}}