{"@context":["https://www.w3.org/ns/did/v1","https://w3id.org/security/suites/jws-2020/v1"],"id":"did:web:tng-cdn-dev.who.int:v2:trustlist:DCC:XXB:DSC","controller":"did:web:tng-cdn-dev.who.int:v2:trustlist:DCC:XXB","verificationMethod":[{"id":"did:web:tng-cdn-dev.who.int:v2:trustlist:DCC:XXB:DSC#EzzSmXSFKt8=","type":"JsonWebKey2020","controller":"did:web:tng-cdn-dev.who.int:v2:trustlist:DCC:XXB","publicKeyJwk":{"kty":"RSA","kid":"EzzSmXSFKt8=","x5c":["MIIEWjCCAkKgAwIBAgIUFS+LL3s4ySmV8xd/t7Tk4AIkJu4wDQYJKoZIhvcNAQELBQAwZDELMAkGA1UEBhMCWEIxGDAWBgNVBAgTD1Rlc3QgQ291bnRyeSBYQjElMCMGA1UEChMcVC1TeXN0ZW1zIEludGVybmF0aW9uYWwgR21iSDEUMBIGA1UECxMLVGVzdCBJc3N1ZXIwHhcNMjMwNjIyMTMyNjA0WhcNMjQwNjIxMTMyNjA0WjBqMQswCQYDVQQGEwJYQjEQMA4GA1UECAwHTm93aGVyZTESMBAGA1UEBwwJU29tZXBsYWNlMSIwIAYDVQQKDBlGaWN0aW9uYWwgVGVzdGluZyBDb21wYW55MREwDwYDVQQDDAhUZXN0Q2VydDCCASIwDQYJKoZIhvcNAQEBBQADggEPADCCAQoCggEBALkUhtx2V+JYBJJbr4OTNNSzfU3n1h3cApkD4VOfOhj8zVOCzWhc49sR3XborvFPK84t54BiZljtDsg706ZxOk9J8CnKwSKggk7uF/nOSA4uNpWku9s9S6p4U6Za/3Dx85MUgFeiAnGxvVxZnJF764wS4Y0UIX3wMnLK8jdT5HQArVWV3YjExZaFkszEXdL6ztH/PPIFF2DsmSEhRW1awkFajtc+LFWocyxSLiHAQPqr5eGvSn5B6szkJ2FmiwK6V+phNNlmD4IVsWtlfo1N3rOyprUopMcUyHoKXbPH/zUZlZqiZc4Ioh8+iOG922Gkcr+kpECeMu480jo8W6yofgUCAwEAATANBgkqhkiG9w0BAQsFAAOCAgEAaoL9NcZYga0tMff8K3waGJXq4Wzed4ED/Pt05oYyXKmB+CQKYfUMuIHIl+xVN4Gm6stoyE48awSTjHxd1CKog5JIBO9CYsV8d7cpSTlpf9UR3R4F1OIClBLkA0n8Wz85xuysxMD3g5ilw/hGKkv3bqEX4gy+tqtGGGsLGUcDd/IaSVdkXHdz3BJSocG7LnvCCHJ3ePjrFmGA8GSU99wHVsYiG/3OVXPyjdnq4n6hJkYA8bu+WB8BVrpbPUMYE6mD3s/zPfxkfsS5QMSSVToaT5tndiwQu86/f03l6sGJKBhEin8l+EqD8GrjyVfoO+SUKJPQZjndZGReDHiCY23sUo7Z1l4SBq4ef/waR2BCjGW2Mo2m8FkzjYgHtiFLyndFUjZlLr6Cj5hXDY+06vV4lu7R+qDzYp6Nscl38c18vJOmiytAHU2/RUh40JBh9OFePqY5kTW8Hgl1uYSqC6PE1nwC3+Lqz4jEv8dEkFpGdZPzGjan6M3NdONEZ+WIGguIVfnF+GwxS/+ph7bXT5buB30+RIFuJPxXKGFYM3CHA4WLMf8xeouxJzulJVRvl3eN825tu2yR5MHqgYPZEHYnlSiKLBU1gnRWNJQ2zWf8KfZvHCAE+GoIqW6HqxWogVkYE86/zg7a1SADDKTS7QgJGfnGXNEppG++pNWxgERbOgU=","MIIFvDCCA6SgAwIBAgIISk4z5MeoufMwDQYJKoZIhvcNAQELBQAwZDELMAkGA1UEBhMCWEIxGDAWBgNVBAgTD1Rlc3QgQ291bnRyeSBYQjElMCMGA1UEChMcVC1TeXN0ZW1zIEludGVybmF0aW9uYWwgR21iSDEUMBIGA1UECxMLVGVzdCBJc3N1ZXIwHhcNMjMwNTIyMDkxMTAwWhcNMzMwNTIyMDkxMTAwWjBkMQswCQYDVQQGEwJYQjEYMBYGA1UECBMPVGVzdCBDb3VudHJ5IFhCMSUwIwYDVQQKExxULVN5c3RlbXMgSW50ZXJuYXRpb25hbCBHbWJIMRQwEgYDVQQLEwtUZXN0IElzc3VlcjCCAiIwDQYJKoZIhvcNAQEBBQADggIPADCCAgoCggIBAOv0M80vH9rX3lHA4NvbXO3FlJXH3rQB7qQFCTz32jTms8qfFIUpZvD7IvT7k/a/1zAhPvsgk4hT0/6Nj/ouPUcIeIOCPqzgCEyE7qIuNEZBKfC738ADdOOd9edoXyrqcVsLu0zx6aoeHE4insvxyKMP3ssfbRcrV/F176pm/JIL8xgu6VeFyVL3ZhaIn2gVhTkCVJoQSIK4jYJ9OEr/6+X3waad0wlleJs+FVb+wWAMOc4HXurPvM+CKGR+VT4aRuHTJtsgYgPcHdRcAcQcPgXqZfs47tMWOm6CXR9Tc1m7mTe1mKvErzvq9uaLTa+lXVYk6X+iSjRPdlCRjt9ul6UJ9EFPdpHUCzwZcFZXRJXhyxdO4ctVwL5PqNuHFj7xPzU96yI5pT4eJrCynEjsEtwwfZGGUWulCTWvBrxnadpMaWjF2+AmsjlK0QTK7gcaSib8AzIMP6CGmlZJEDu2PYTP1f/EtU9sWiXA7hSjnEJEJsKZnrAiiRXLRbq7AvQHknHfqKoK9otro/zP5saat08QHuZ8JkTHRsin2szcb3ZqwnE3NiSW0L4EupsSnkjLK+YZQkkY4WJwbgjH4QMrv/qMoIpurc0e0AywT1ugEK3ccq0cNeT35LhxYOIotH1Qt+AI/WZ9T3sGSZD+6qWXqN3SOei2QQYu5VUbVn4eOUzNAgMBAAGjcjBwMA8GA1UdEwEB/wQFMAMBAf8wHQYDVR0OBBYEFBlg7vWwYU9KaST7Y2brN6hGDP9eMAsGA1UdDwQEAwIBBjARBglghkgBhvhCAQEEBAMCAAcwHgYJYIZIAYb4QgENBBEWD3hjYSBjZXJ0aWZpY2F0ZTANBgkqhkiG9w0BAQsFAAOCAgEARfCS03gNZg5akpwy6Lf9Sh3R1xz1U0OJImAg6tfh/0mBFt+PeKRjAVTYSsJHu8FFhKt+F63r+bNRsOxBwjXWrgnhCc25vwuUceg8WH+rT3uMEy7aa3qIouYpxrS9UpHK2Dpkuz/IKxz2RRPET9izf3k9/nQG2r1awtJIu/tl/+ww1nt5zOLLaZb6O8I8hdtERrI1hA78G8/29jdOxKEA9yeYYK9Nd4Oj0fMdqvEbxn5qOnM94TDnH+swCQGA0M0y43wUwVf7NhsvesB76BsduKxhqz9Q51p+YY0CyCffVQZ6scn/i2IdskIDhY3ziByMASF7ZPCMCkCXMB+QUQvPxa8AyXK736CAIHmwBpopVsgL4/7zWQFteJ4reXIA3VABo9cRUjJU+LgMYCobhWD6DJHtrAVtWKAhXIBEgG6XYbGmwIupUGR5KaQDeRypG/JG5p4PjI4Ic5sjylzdmjz0jhcS7P636JY2okchSXRbLMZWS7rF2W+GVd0l1Wjn0SQljbScTG65gJDKPxNcpyGaOvAfiwhY2irJJOvyXlBfA6zH7/GL6K1amAbAnJUg/9XOQyh9xJXkOfARarFq9POcJoyJsU7rXuX9+yCm/eIKqVPhaKtPf9yeNBdYtqqkJAMyVhDzl5OT55Sh46KVazXUy6U9pISrZtDwRTUWQrgPB64="],"e":"AQAB","n":"ALkUhtx2V-JYBJJbr4OTNNSzfU3n1h3cApkD4VOfOhj8zVOCzWhc49sR3XborvFPK84t54BiZljtDsg706ZxOk9J8CnKwSKggk7uF_nOSA4uNpWku9s9S6p4U6Za_3Dx85MUgFeiAnGxvVxZnJF764wS4Y0UIX3wMnLK8jdT5HQArVWV3YjExZaFkszEXdL6ztH_PPIFF2DsmSEhRW1awkFajtc-LFWocyxSLiHAQPqr5eGvSn5B6szkJ2FmiwK6V-phNNlmD4IVsWtlfo1N3rOyprUopMcUyHoKXbPH_zUZlZqiZc4Ioh8-iOG922Gkcr-kpECeMu480jo8W6yofgU"}}],"proof":{"type":"JsonWebSignature2020","created":"2025-04-04T18:00:18Z","nonce":"yYpPhLBJWYmPFYJrYv8GdeeJYUdvMKMD","proofPurpose":"assertionMethod","verificationMethod":"did:web:raw.githubusercontent.com:WorldHealthOrganization:tng-participants-dev:main:WHO:signing:DID","jws":"eyJiNjQiOmZhbHNlLCJjcml0IjpbImI2NCJdLCJhbGciOiJFUzI1NiJ9..MEQCIDW9vgEcQLrgkbLYR9-7W5RVmPPtgh1rk8XeiHZQdJMdAiAJ_oOc640C4avHHKU6qXxwE88o73q5LvXnpqSsQsEEDA"}}