{"@context":["https://www.w3.org/ns/did/v1","https://w3id.org/security/suites/jws-2020/v1"],"id":"did:web:worldhealthorganization.github.io:tng-cdn-dev:v2.0.0:trustlist:-:ARM:SCA","controller":"did:web:worldhealthorganization.github.io:tng-cdn-dev:v2.0.0:trustlist:-:ARM","verificationMethod":[{"id":"did:web:worldhealthorganization.github.io:tng-cdn-dev:v2.0.0:trustlist:-:ARM:SCA#eWNhaERnbjlWT3M9","type":"JsonWebKey2020","controller":"did:web:worldhealthorganization.github.io:tng-cdn-dev:v2.0.0:trustlist:-:ARM","publicKeyJwk":{"kty":"EC","kid":"eWNhaERnbjlWT3M9","x5c":["MIIB+zCCAaKgAwIBAgIJAIqTXyTIdku7MAoGCCqGSM49BAMCMGAxCzAJBgNVBAYTAkFNMRAwDgYDVQQHDAdZZXJldmFuMQ4wDAYDVQQKDAVBcm1lZDEWMBQGA1UECwwNREdDT3BlcmF0aW9uczEXMBUGA1UEAwwOQ1NDQV9ER0NfQU1fMDEwHhcNMjEwOTIyMTE0MDQ3WhcNMjUwOTIyMTE0MDQ3WjBgMQswCQYDVQQGEwJBTTEQMA4GA1UEBwwHWWVyZXZhbjEOMAwGA1UECgwFQXJtZWQxFjAUBgNVBAsMDURHQ09wZXJhdGlvbnMxFzAVBgNVBAMMDkNTQ0FfREdDX0FNXzAxMFkwEwYHKoZIzj0CAQYIKoZIzj0DAQcDQgAEsO/j2se5rbfvzqDbWfqcBa8vbO17pZ2vhIlDDaNHfzsDgGn8PZ6dE38BQF+Xw2bxnyB7zN/y0K1zWXnC6YYxF6NFMEMwEgYDVR0TAQH/BAgwBgEB/wIBADAOBgNVHQ8BAf8EBAMCAQYwHQYDVR0OBBYEFBx3IMIf1ITSlFm9KKgiEhZvZLATMAoGCCqGSM49BAMCA0cAMEQCIAifE7vl+dfj1nZ6hvLAJcf3W9XbcTsNAxKOG6O3OBvNAiATdcju154WPI8N9+smb9Cng0dz7R8kwuEu6ESNb9nLeg=="],"crv":"P-256","x":"ALDv49rHua23786g21n6nAWvL2zte6Wdr4SJQw2jR387","y":"A4Bp_D2enRN_AUBfl8Nm8Z8ge8zf8tCtc1l5wumGMRc"}}],"proof":{"type":"JsonWebSignature2020","created":"2024-10-24T12:00:19Z","nonce":"qeXQJmVQbEkLL5tMsq60qZ9Jiw8LnFuy","proofPurpose":"assertionMethod","verificationMethod":"did:web:raw.githubusercontent.com:WorldHealthOrganization:tng-participants-dev:main:WHO:signing:DID","jws":"eyJiNjQiOmZhbHNlLCJjcml0IjpbImI2NCJdLCJhbGciOiJFUzI1NiJ9..MEUCIQD1HxWruxmY1EeKxCiQvrIXlwn0Kyw0-5SVScW0OVJ0aAIgLhIZMuBVZZ1FPhQM81UDSv0U5vgRV8wreNAjoAp9LhE"}}