{"@context":["https://www.w3.org/ns/did/v1","https://w3id.org/security/suites/jws-2020/v1"],"id":"did:web:worldhealthorganization.github.io:tng-cdn-dev:v2.0.0:trustlist:PH4H:XCL:SCA","controller":"did:web:worldhealthorganization.github.io:tng-cdn-dev:v2.0.0:trustlist:PH4H:XCL","verificationMethod":[{"id":"did:web:worldhealthorganization.github.io:tng-cdn-dev:v2.0.0:trustlist:PH4H:XCL:SCA#aFJKRk4rZGFRckk9","type":"JsonWebKey2020","controller":"did:web:worldhealthorganization.github.io:tng-cdn-dev:v2.0.0:trustlist:PH4H:XCL","publicKeyJwk":{"kty":"EC","kid":"aFJKRk4rZGFRckk9","x5c":["MIICAjCCAaegAwIBAgIUKF4lTmfdzK4G2N70l0ZsuqwnvCUwCgYIKoZIzj0EAwIwXTELMAkGA1UEBhMCWEwxCzAJBgNVBAgMAk1UMREwDwYDVQQHDAhTYW50aWFnbzEPMA0GA1UECgwGQ3JlYXRlMQwwCgYDVQQLDANSJkQxDzANBgNVBAMMBkNyZWF0ZTAeFw0yNDA5MTAyMDUxMjhaFw0yODA5MTAyMDUxMjhaMF0xCzAJBgNVBAYTAlhMMQswCQYDVQQIDAJNVDERMA8GA1UEBwwIU2FudGlhZ28xDzANBgNVBAoMBkNyZWF0ZTEMMAoGA1UECwwDUiZEMQ8wDQYDVQQDDAZDcmVhdGUwWTATBgcqhkjOPQIBBggqhkjOPQMBBwNCAATwTvXHsCOZVe8cux/7YJF1Z5fTQJBWjiOlosaXWxi+72l4i8PECtFyEV+s1vk8ynZ8BSlEanXA7yWnzXf1mZsHo0UwQzASBgNVHRMBAf8ECDAGAQH/AgEAMA4GA1UdDwEB/wQEAwIBBjAdBgNVHQ4EFgQUltU4J1etuXVuGvSffa+h2q0xeGowCgYIKoZIzj0EAwIDSQAwRgIhAMbyCD/0VopFYhpYdxUWomzSwlH5iqBlgym9DmsTeUvwAiEA3CyeKGAibv5NIj7EkGazFTP+gvqAvPAqViVNty9TJWo="],"crv":"P-256","x":"APBO9cewI5lV7xy7H_tgkXVnl9NAkFaOI6WixpdbGL7v","y":"aXiLw8QK0XIRX6zW-TzKdnwFKURqdcDvJafNd_WZmwc"}}],"proof":{"type":"JsonWebSignature2020","created":"2024-10-24T12:00:18Z","nonce":"7Hp6cHRbTtlBdShpJFg75elVOyH2HJJA","proofPurpose":"assertionMethod","verificationMethod":"did:web:raw.githubusercontent.com:WorldHealthOrganization:tng-participants-dev:main:WHO:signing:DID","jws":"eyJiNjQiOmZhbHNlLCJjcml0IjpbImI2NCJdLCJhbGciOiJFUzI1NiJ9..MEQCIHGf793917m0h9xlv6UPvWPUWIMej6Vn0dG_VEollE4LAiA0RZdWNfh3bQFGvVm7J0DSsWEX5f8yQwcKTxSbNWueCg"}}