{"@context":["https://www.w3.org/ns/did/v1","https://w3id.org/security/suites/jws-2020/v1"],"id":"did:web:worldhealthorganization.github.io:tng-cdn-dev:v2.0.0:trustlist:RACSEL-DDVC:SLV","controller":"did:web:worldhealthorganization.github.io:tng-cdn-dev:v2.0.0:trustlist:RACSEL-DDVC:SLV","verificationMethod":[{"id":"did:web:worldhealthorganization.github.io:tng-cdn-dev:v2.0.0:trustlist:RACSEL-DDVC:SLV#qu9yMGgrzMs%3D","type":"JsonWebKey2020","controller":"did:web:worldhealthorganization.github.io:tng-cdn-dev:v2.0.0:trustlist:RACSEL-DDVC:SLV","publicKeyJwk":{"kty":"EC","kid":"qu9yMGgrzMs%3D","x5c":["MIICTDCCAfGgAwIBAgIUVmTbCq9VIqZba5UwoJDV2ogIy48wCgYIKoZIzj0EAwIwgYExCzAJBgNVBAYTAlNWMRQwEgYDVQQIDAtFbCBTYWx2YWRvcjEdMBsGA1UEBwwUTEFDUGFzcyBDb25uZWN0YXRob24xDDAKBgNVBAoMA1dITzEMMAoGA1UECwwDUiZEMSEwHwYDVQQDDBhMQUNQYXNzIENvbm5lY3RhdGhvbiBUTkcwHhcNMjMxMDI1MTQwODU2WhcNMjcxMDI1MTQwODU2WjCBgTELMAkGA1UEBhMCU1YxFDASBgNVBAgMC0VsIFNhbHZhZG9yMR0wGwYDVQQHDBRMQUNQYXNzIENvbm5lY3RhdGhvbjEMMAoGA1UECgwDV0hPMQwwCgYDVQQLDANSJkQxITAfBgNVBAMMGExBQ1Bhc3MgQ29ubmVjdGF0aG9uIFRORzBZMBMGByqGSM49AgEGCCqGSM49AwEHA0IABJNU7iuWqNUKk9fIt52t8KQPA0F+bzLw/sWHH8rABRK5G1Q28omWK8pBYyAKKOzLPbe2y90YIOwlhszOFMxDu7ijRTBDMBIGA1UdEwEB/wQIMAYBAf8CAQAwDgYDVR0PAQH/BAQDAgEGMB0GA1UdDgQWBBQWWaYvTrDQAsj+kV5cRePecRcXpTAKBggqhkjOPQQDAgNJADBGAiEAn3F909mZQdKgvctbLb/L2CZ7fHRvZe5CoGowOp88mjMCIQCcBIM9v2JdY8ymhHYP8/+OMFU7J0uPtj9NURhrxv0TUQ=="],"crv":"P-256","x":"AJNU7iuWqNUKk9fIt52t8KQPA0F-bzLw_sWHH8rABRK5","y":"G1Q28omWK8pBYyAKKOzLPbe2y90YIOwlhszOFMxDu7g="}}],"proof":{"type":"JsonWebSignature2020","created":"2024-07-02T00:00:11Z","nonce":"XXBjspO3artdYI2n9A8ZDCvybIoJQT40","proofPurpose":"assertionMethod","verificationMethod":"did:web:raw.githubusercontent.com:WorldHealthOrganization:tng-participants-dev:main:WHO:signing:DID","jws":"eyJiNjQiOmZhbHNlLCJjcml0IjpbImI2NCJdLCJhbGciOiJFUzI1NiJ9..MEUCIQCjc5FXyXCMOa8_-MtFuOVid2XSzvGYmTseKgy1lbcc7gIgbqRmSN3hhV_F5U7V9NDAzdC1d_2K5s3hDLYwb9kKpwc"}}