{"@context":["https://www.w3.org/ns/did/v1","https://w3id.org/security/suites/jws-2020/v1"],"id":"did:web:tng-cdn-dev.who.int:v2:trustlist:DCC:PRY:DSC","controller":"did:web:tng-cdn-dev.who.int:v2:trustlist:DCC:PRY","verificationMethod":[{"id":"did:web:tng-cdn-dev.who.int:v2:trustlist:DCC:PRY:DSC#dZKOLB0pfpk=","type":"JsonWebKey2020","controller":"did:web:tng-cdn-dev.who.int:v2:trustlist:DCC:PRY","publicKeyJwk":{"kty":"EC","kid":"dZKOLB0pfpk=","x5c":["MIICgjCCAimgAwIBAgIUfH84rRPMd9dKVIkFc/npwJjvGjQwCgYIKoZIzj0EAwIwfjELMAkGA1UEBhMCUFkxETAPBgNVBAgMCFBhcmFndWF5MR0wGwYDVQQHDBRMQUNQYXNzIENvbm5lY3RhdGhvbjEMMAoGA1UECgwDV0hPMQwwCgYDVQQLDANSJkQxITAfBgNVBAMMGExBQ1Bhc3MgQ29ubmVjdGF0aG9uIFRORzAeFw0yMzEwMzAyMTA4NDJaFw0yNTEwMjkyMTA4NDJaMEUxCzAJBgNVBAYTAlBZMRMwEQYDVQQIDApTb21lLVN0YXRlMSEwHwYDVQQKDBhJbnRlcm5ldCBXaWRnaXRzIFB0eSBMdGQwWTATBgcqhkjOPQIBBggqhkjOPQMBBwNCAARmTr5PH0ZbVxJU5nRyf6CtDTRwMO+M6QdtCgPEbjWPLt5ab/XN+WP1jdTm52OW28JZv3rq73ZVA3+Yx18LZsYIo4G9MIG6MA4GA1UdDwEB/wQEAwIChDAdBgNVHQ4EFgQUUOX7K3acRHG5VyjyjI/HuQq07iMwHwYDVR0jBBgwFoAUhFoev7FDANIaqtzlP3CXyj7F9jEwNgYDVR0fBC8wLTAroCmgJ4YlaHR0cDovL2xhY3Bhc3MucmFjc2VsLm9yZy9DUkwvU0NBLmNybDAwBgNVHSUEKTAnBgsrBgEEAY43j2UBAQYLKwYBBAGON49lAQIGCysGAQQBjjePZQEDMAoGCCqGSM49BAMCA0cAMEQCICfsW5irpF6K1qH8LQ/mnUEoaNtqxq4D6mvitxQqQ2P4AiBbNRfSHq7lreKPEx6KTYNPIOC2BBbUY5Ug9NRxYeIdLg=="],"crv":"P-256","x":"Zk6-Tx9GW1cSVOZ0cn-grQ00cDDvjOkHbQoDxG41jy4","y":"AN5ab_XN-WP1jdTm52OW28JZv3rq73ZVA3-Yx18LZsYI"}}],"proof":{"type":"JsonWebSignature2020","created":"2025-02-24T12:00:14Z","nonce":"2HOneNgRJjZantM3to2UiZi3NyGmTn2t","proofPurpose":"assertionMethod","verificationMethod":"did:web:raw.githubusercontent.com:WorldHealthOrganization:tng-participants-dev:main:WHO:signing:DID","jws":"eyJiNjQiOmZhbHNlLCJjcml0IjpbImI2NCJdLCJhbGciOiJFUzI1NiJ9..MEQCIElNZ6dxnga-8iWb7Rvyx_6VBx7qTFWK3PiTL7LBESgUAiB1XumItJRizr40P1PY2JyBvk50rBIDZ5i3SOYssztpLA"}}