{"@context":["https://www.w3.org/ns/did/v1","https://w3id.org/security/suites/jws-2020/v1"],"id":"did:web:worldhealthorganization.github.io:tng-cdn-dev:v2.0.0:trustlist:-:AND:SCA","controller":"did:web:worldhealthorganization.github.io:tng-cdn-dev:v2.0.0:trustlist:-:AND:SCA","verificationMethod":[{"id":"did:web:worldhealthorganization.github.io:tng-cdn-dev:v2.0.0:trustlist:-:AND:SCA#clViU2JhaE92YWs9","type":"JsonWebKey2020","controller":"did:web:worldhealthorganization.github.io:tng-cdn-dev:v2.0.0:trustlist:-:AND:SCA","publicKeyJwk":{"kty":"EC","kid":"clViU2JhaE92YWs9","x5c":["MIICyzCCAnGgAwIBAgIUQKPBF8Oqt93AAaBJNKIfyrGfnnowCgYIKoZIzj0EAwIwgcExCzAJBgNVBAYTAkFEMRgwFgYDVQQIDA9UZXN0IEFuZG9ycmEgQUQxGzAZBgNVBAcMEkVzY2FsZGVzLUVuZ29yZGFueTFHMEUGA1UECgw+QW5kb3JyYSBIZWFsdGhjYXJlIC0gU2VydmVpIEFuZG9ycmEgZCBBdGVuY2lvIFNhbml0YXJpYSAtIFNBQVMxDTALBgNVBAsMBFNTSUkxIzAhBgNVBAMMGlRFU1QtQURfVE5QX1NDQV9URVNUMjQwNzA4MB4XDTI0MDcwODExMzYxNloXDTI4MDcwODExMzYxNlowgcExCzAJBgNVBAYTAkFEMRgwFgYDVQQIDA9UZXN0IEFuZG9ycmEgQUQxGzAZBgNVBAcMEkVzY2FsZGVzLUVuZ29yZGFueTFHMEUGA1UECgw+QW5kb3JyYSBIZWFsdGhjYXJlIC0gU2VydmVpIEFuZG9ycmEgZCBBdGVuY2lvIFNhbml0YXJpYSAtIFNBQVMxDTALBgNVBAsMBFNTSUkxIzAhBgNVBAMMGlRFU1QtQURfVE5QX1NDQV9URVNUMjQwNzA4MFkwEwYHKoZIzj0CAQYIKoZIzj0DAQcDQgAEp15Gk+VGP8Pu7mZMA76+sIbxbHS0hGEPWnVcSVge8JZdtOZuM25COgclJ0si2VDv9VBBCTPICHKjuBjX+9ZdQ6NFMEMwEgYDVR0TAQH/BAgwBgEB/wIBADAOBgNVHQ8BAf8EBAMCAQYwHQYDVR0OBBYEFJb0c3AVIfLhSFtZbcpcx1m13YtiMAoGCCqGSM49BAMCA0gAMEUCIDkK2fgCk+QDJeahew++R4hD6+wsce2XDuHPt/JhDi6VAiEAi9ABR4WaIDUvBPLSl+fS2hPch837X/8nEnLh0LOZ1LI="],"crv":"P-256","x":"AKdeRpPlRj_D7u5mTAO-vrCG8Wx0tIRhD1p1XElYHvCW","y":"XbTmbjNuQjoHJSdLItlQ7_VQQQkzyAhyo7gY1_vWXUM"}}],"proof":{"type":"JsonWebSignature2020","created":"2024-08-09T12:00:22Z","nonce":"N6LsOZJuzkoUKpUoHQm5tAmY79g6YMyV","proofPurpose":"assertionMethod","verificationMethod":"did:web:raw.githubusercontent.com:WorldHealthOrganization:tng-participants-dev:main:WHO:signing:DID","jws":"eyJiNjQiOmZhbHNlLCJjcml0IjpbImI2NCJdLCJhbGciOiJFUzI1NiJ9..MEQCIAyzo6pMYnUsgl5NEjn_3hzi0n37FavVamd_reUKlYsQAiBZkPEhdei860dQxTM8_XgV6xp-97TeebUKKq90af2zOQ"}}