{"@context":["https://www.w3.org/ns/did/v1","https://w3id.org/security/suites/jws-2020/v1"],"id":"did:web:worldhealthorganization.github.io:tng-cdn-dev:v2.0.0:trustlist:-:XH:SCA","controller":"did:web:worldhealthorganization.github.io:tng-cdn-dev:v2.0.0:trustlist:-:XH","verificationMethod":[{"id":"did:web:worldhealthorganization.github.io:tng-cdn-dev:v2.0.0:trustlist:-:XH:SCA#eFgrTFRvRjZTdnc9","type":"JsonWebKey2020","controller":"did:web:worldhealthorganization.github.io:tng-cdn-dev:v2.0.0:trustlist:-:XH","publicKeyJwk":{"kty":"EC","kid":"eFgrTFRvRjZTdnc9","x5c":["MIICIzCCAcmgAwIBAgIUJH9e7VaHqacNDEtquPvM9JV4DQYwCgYIKoZIzj0EAwIwbjELMAkGA1UEBhMCWEgxDzANBgNVBAgMBlZlcmRlMTESMBAGA1UEBwwJVmVyZGVjaXRhMREwDwYDVQQKDAhHcmVlbmVyczEMMAoGA1UECwwDUiZEMRkwFwYDVQQDDBBOYXRpb25YQV9UTlBfU0NBMB4XDTI0MTAwNzAzMTMzNFoXDTI4MTAwNzAzMTMzNFowbjELMAkGA1UEBhMCWEgxDzANBgNVBAgMBlZlcmRlMTESMBAGA1UEBwwJVmVyZGVjaXRhMREwDwYDVQQKDAhHcmVlbmVyczEMMAoGA1UECwwDUiZEMRkwFwYDVQQDDBBOYXRpb25YQV9UTlBfU0NBMFkwEwYHKoZIzj0CAQYIKoZIzj0DAQcDQgAEpz9xQ1K6GUnz2naaSh5DspEOxqlkyvVLP1u1gBlbvIEe5jH8trOm2/k5WmaV3aGd9KuMJA9CZc9Omoca53f2GqNFMEMwEgYDVR0TAQH/BAgwBgEB/wIBADAOBgNVHQ8BAf8EBAMCAQYwHQYDVR0OBBYEFN60AhwwEXGAx2MYeT/MfIAm6tnkMAoGCCqGSM49BAMCA0gAMEUCIDYbcICjsG0Ml8q0I+nMRmrXOhi8OoGo0s7y7GfqxCcvAiEAieHD+CSjCUPZ/Req9fHA6f3U/OIbJfHLaFJdwi1IUFA="],"crv":"P-256","x":"AKc_cUNSuhlJ89p2mkoeQ7KRDsapZMr1Sz9btYAZW7yB","y":"HuYx_Lazptv5OVpmld2hnfSrjCQPQmXPTpqHGud39ho"}}],"proof":{"type":"JsonWebSignature2020","created":"2024-10-24T12:00:22Z","nonce":"QfaDOUqTBRH7oSLnBJtnqLWX8u7aY123","proofPurpose":"assertionMethod","verificationMethod":"did:web:raw.githubusercontent.com:WorldHealthOrganization:tng-participants-dev:main:WHO:signing:DID","jws":"eyJiNjQiOmZhbHNlLCJjcml0IjpbImI2NCJdLCJhbGciOiJFUzI1NiJ9..MEUCIQDsnfYtWZJkfuSiqc-UFsm2LoqiA76sNwgeYJ38mSMUAgIgU9vHUAHqHCJbvHNHo4BE8Ai0X2pd-YQ3kfUbHBZZNw0"}}