{"@context":["https://www.w3.org/ns/did/v1","https://w3id.org/security/suites/jws-2020/v1"],"id":"did:web:worldhealthorganization.github.io:tng-cdn-dev:v2.0.0:trustlist:PH4H:CRI:DSC","controller":"did:web:worldhealthorganization.github.io:tng-cdn-dev:v2.0.0:trustlist:PH4H:CRI","verificationMethod":[{"id":"did:web:worldhealthorganization.github.io:tng-cdn-dev:v2.0.0:trustlist:PH4H:CRI:DSC#QkZ3S0F1dXZGM1k9","type":"JsonWebKey2020","controller":"did:web:worldhealthorganization.github.io:tng-cdn-dev:v2.0.0:trustlist:PH4H:CRI","publicKeyJwk":{"kty":"EC","kid":"QkZ3S0F1dXZGM1k9","x5c":["MIICyjCCAnCgAwIBAgIUPm/T8RzDvMr3tPyKw40TKOkKbegwCgYIKoZIzj0EAwIwgYgxCzAJBgNVBAYTAkNSMREwDwYDVQQIDAhTYW4gSm9zZTERMA8GA1UEBwwIU2FuIEpvc2UxKTAnBgNVBAoMIENhamEgQ29zdGFycmljZW5zZSBTZWd1cm8gU29jaWFsMQ0wCwYDVQQLDARDQ1NTMRkwFwYDVQQDDBBOYXRpb25YQV9UTlBfU0NBMB4XDTI0MTAyMjE5MTQyOVoXDTI2MTAyMjE5MTQyOVowgZMxCzAJBgNVBAYTAkNSMREwDwYDVQQIDAhTYW4gSm9zZTERMA8GA1UEBwwIU2FuIEpvc2UxKTAnBgNVBAoMIENhamEgQ29zdGFycmljZW5zZSBTZWd1cm8gU29jaWFsMQ0wCwYDVQQLDARDQ1NTMSQwIgYDVQQDDBtIZWFsdGggQWRtaW5pc3RyYXRpb24gb2YgWEEwWTATBgcqhkjOPQIBBggqhkjOPQMBBwNCAARE6Lus9B5ohcjKgNrOPYtFERBNCbBXOlButcss2BT3r1vACp4eJnXErSFArspZE9VHeZkcHrMHLatrbtawtKuLo4GqMIGnMA4GA1UdDwEB/wQEAwIHgDAdBgNVHQ4EFgQUMcal+TcIPVBmJKuN5kyBcatjYdwwHwYDVR0jBBgwFoAUlKeTVG0ip/eiLJVUMwlufpkNl4YwPQYDVR0fBDYwNDAyoDCgLoYsaHR0cDovL2NybC5leGFtcGxlZG9tYWluLmV4YW1wbGUvQ1JML1NDQS5jcmwwFgYDVR0lBA8wDQYLKwYBBAGON49lAQEwCgYIKoZIzj0EAwIDSAAwRQIhALIMFgPTuuehpIIou2DHrer2vwF5afxYc3vv1CLy8OsIAiAuUED5BwzpeJZaCMrwItGqOEpU1L6G9UEAk4GRlsZtJA==","MIICWTCCAf+gAwIBAgIUDubhBFA3y+L6fa5o2rhXzum82+EwCgYIKoZIzj0EAwIwgYgxCzAJBgNVBAYTAkNSMREwDwYDVQQIDAhTYW4gSm9zZTERMA8GA1UEBwwIU2FuIEpvc2UxKTAnBgNVBAoMIENhamEgQ29zdGFycmljZW5zZSBTZWd1cm8gU29jaWFsMQ0wCwYDVQQLDARDQ1NTMRkwFwYDVQQDDBBOYXRpb25YQV9UTlBfU0NBMB4XDTI0MTAxNjA0MDgwNFoXDTI4MTAxNjA0MDgwNFowgYgxCzAJBgNVBAYTAkNSMREwDwYDVQQIDAhTYW4gSm9zZTERMA8GA1UEBwwIU2FuIEpvc2UxKTAnBgNVBAoMIENhamEgQ29zdGFycmljZW5zZSBTZWd1cm8gU29jaWFsMQ0wCwYDVQQLDARDQ1NTMRkwFwYDVQQDDBBOYXRpb25YQV9UTlBfU0NBMFkwEwYHKoZIzj0CAQYIKoZIzj0DAQcDQgAEDufmfoNiUATDkIP4+eZY3c6z49noO2M0au2TZfBzy8Ps7BXRbSEUxj2lXgHPJf+DInL9z4pxrNd++QCaAq57B6NFMEMwEgYDVR0TAQH/BAgwBgEB/wIBADAOBgNVHQ8BAf8EBAMCAQYwHQYDVR0OBBYEFJSnk1RtIqf3oiyVVDMJbn6ZDZeGMAoGCCqGSM49BAMCA0gAMEUCICNKZuPJzuF19PWmv6Xm12kIrkRkpfe5mAAKicZ5h6xGAiEAnH0Z6ME6CxlowuusRvRFrc+Xe6Qy/4zCIWSrK4vQg/M="],"crv":"P-256","x":"ROi7rPQeaIXIyoDazj2LRREQTQmwVzpQbrXLLNgU968","y":"W8AKnh4mdcStIUCuylkT1Ud5mRweswctq2tu1rC0q4s"}}],"proof":{"type":"JsonWebSignature2020","created":"2024-10-24T12:00:17Z","nonce":"GGSiy1p8TLjkSjruIcNWFtaAZU7GJKcO","proofPurpose":"assertionMethod","verificationMethod":"did:web:raw.githubusercontent.com:WorldHealthOrganization:tng-participants-dev:main:WHO:signing:DID","jws":"eyJiNjQiOmZhbHNlLCJjcml0IjpbImI2NCJdLCJhbGciOiJFUzI1NiJ9..MEUCIQDyLXao1fZquYcSbOoqrPhrzyhTnoECWBjmY3rv8QU3DwIgDs9kxfktHHake5Lqh1UVvI7m9rB6RKTNxlSfTej1h2s"}}