{"@context":["https://www.w3.org/ns/did/v1","https://w3id.org/security/suites/jws-2020/v1"],"id":"did:web:worldhealthorganization.github.io:tng-cdn-dev:v2.0.0:trustlist:RACSEL-DDVC:-:SCA:M3dpS0JDYUZ1b2s9","controller":"did:web:worldhealthorganization.github.io:tng-cdn-dev:v2.0.0:trustlist:RACSEL-DDVC:-:SCA:M3dpS0JDYUZ1b2s9","verificationMethod":[{"id":"did:web:worldhealthorganization.github.io:tng-cdn-dev:v2.0.0:trustlist:RACSEL-DDVC:-:SCA:M3dpS0JDYUZ1b2s9#M3dpS0JDYUZ1b2s9","type":"JsonWebKey2020","controller":"did:web:worldhealthorganization.github.io:tng-cdn-dev:v2.0.0:trustlist:RACSEL-DDVC:-:SCA:M3dpS0JDYUZ1b2s9","publicKeyJwk":{"kty":"EC","kid":"M3dpS0JDYUZ1b2s9","x5c":["MIICFTCCAbugAwIBAgIUZg3GCdgTYDbAORHyethAud82ETAwCgYIKoZIzj0EAwIwZzELMAkGA1UEBhMCWEwxCzAJBgNVBAgMAk1UMREwDwYDVQQHDAhTQU5USUFHTzEPMA0GA1UECgwGQ1JFQVRFMQwwCgYDVQQLDANSJkQxGTAXBgNVBAMMEE5hdGlvblhMX1ROUF9TQ0EwHhcNMjMxMDA0MTUyMTI3WhcNMjcxMDA0MTUyMTI3WjBnMQswCQYDVQQGEwJYTDELMAkGA1UECAwCTVQxETAPBgNVBAcMCFNBTlRJQUdPMQ8wDQYDVQQKDAZDUkVBVEUxDDAKBgNVBAsMA1ImRDEZMBcGA1UEAwwQTmF0aW9uWExfVE5QX1NDQTBZMBMGByqGSM49AgEGCCqGSM49AwEHA0IABOUht3wSLNl4Ae1/wRUfVY1CTKrOog+vuIyrIUOdCcIumeAz8AckJdfVTN5+sVcGkw1T8kQFMNaf5lCv8QH6jXWjRTBDMBIGA1UdEwEB/wQIMAYBAf8CAQAwDgYDVR0PAQH/BAQDAgEGMB0GA1UdDgQWBBQmHPdh8sTGTj8CpqhvKV/RXTwIujAKBggqhkjOPQQDAgNIADBFAiAOsxW3y3KitIQUu3NnKVL79Hc4wuAESSfDN2H6NGtCxQIhAKAmub3n49gFLDFcpc4rOX9GgUGvf5XEbzuXtMADgsll"],"crv":"P-256","x":"AOUht3wSLNl4Ae1_wRUfVY1CTKrOog-vuIyrIUOdCcIu","y":"AJngM_AHJCXX1UzefrFXBpMNU_JEBTDWn-ZQr_EB-o11"}}],"proof":{"type":"JsonWebSignature2020","created":"2024-08-09T12:00:30Z","nonce":"MkKkmQnc3BD2WeZgO4c0OZc2bF4g9izA","proofPurpose":"assertionMethod","verificationMethod":"did:web:raw.githubusercontent.com:WorldHealthOrganization:tng-participants-dev:main:WHO:signing:DID","jws":"eyJiNjQiOmZhbHNlLCJjcml0IjpbImI2NCJdLCJhbGciOiJFUzI1NiJ9..MEYCIQDJaL3cf69rJqKHJTHvwAZxIKmwyrEg-LYQa1v7XdvqLgIhAKNoSAj6C9YRJDQH5wz5O-e1BUwMfzhYOZxzNO7hFaqk"}}