{"@context":["https://www.w3.org/ns/did/v1","https://w3id.org/security/suites/jws-2020/v1"],"id":"did:web:worldhealthorganization.github.io:tng-cdn-dev:v2.0.0:trustlist:DCC:COL:DSC","controller":"did:web:worldhealthorganization.github.io:tng-cdn-dev:v2.0.0:trustlist:DCC:COL:DSC","verificationMethod":[{"id":"did:web:worldhealthorganization.github.io:tng-cdn-dev:v2.0.0:trustlist:DCC:COL:DSC:TlVGWiswNzlUOGM9","type":"JsonWebKey2020","controller":"did:web:worldhealthorganization.github.io:tng-cdn-dev:v2.0.0:trustlist:DCC:COL:DSC","publicKeyJwk":{"kty":"EC","kid":"TlVGWiswNzlUOGM9","x5c":["MIICgjCCAimgAwIBAgIUdkFiFa6zhu4Nvkgai6aCDmJiJ8owCgYIKoZIzj0EAwIwfjELMAkGA1UEBhMCQ08xETAPBgNVBAgMCENvbG9tYmlhMR0wGwYDVQQHDBRMQUNQYXNzIENvbm5lY3RhdGhvbjEMMAoGA1UECgwDV0hPMQwwCgYDVQQLDANSJkQxITAfBgNVBAMMGExBQ1Bhc3MgQ29ubmVjdGF0aG9uIFRORzAeFw0yMzEwMzAyMTA3MDRaFw0yNTEwMjkyMTA3MDRaMEUxCzAJBgNVBAYTAkNPMRMwEQYDVQQIDApTb21lLVN0YXRlMSEwHwYDVQQKDBhJbnRlcm5ldCBXaWRnaXRzIFB0eSBMdGQwWTATBgcqhkjOPQIBBggqhkjOPQMBBwNCAATO5ukRgsp3wWVe/hnVIpPCDwEwEFf0JsEim2bLB8bRNRLT+GfAdoVZcuFQ0vaZZfD59ijKilvVu+lxAgzh2Eueo4G9MIG6MA4GA1UdDwEB/wQEAwIChDAdBgNVHQ4EFgQUyfQ/erF4IJgqPIm09ATvJFwT8fIwHwYDVR0jBBgwFoAUUiJN/I+agNn12zlIa05avek0FeAwNgYDVR0fBC8wLTAroCmgJ4YlaHR0cDovL2xhY3Bhc3MucmFjc2VsLm9yZy9DUkwvU0NBLmNybDAwBgNVHSUEKTAnBgsrBgEEAY43j2UBAQYLKwYBBAGON49lAQIGCysGAQQBjjePZQEDMAoGCCqGSM49BAMCA0cAMEQCIDHuZRvjLqsP0zqNAE7v01HrUrA71tFL9H1v993bj22vAiBDk7eMp0ByHKPnwJ/DcC3vZZdyVXKQq/Se3NtCfOKUcQ=="],"crv":"P-256","x":"AM7m6RGCynfBZV7-GdUik8IPATAQV_QmwSKbZssHxtE1","y":"EtP4Z8B2hVly4VDS9pll8Pn2KMqKW9W76XECDOHYS54"}}],"proof":{"type":"JsonWebSignature2020","created":"2024-10-07T06:00:06Z","nonce":"Ir8mnJ0om0HXsHsLcc9rW3O8PevjaMPN","proofPurpose":"assertionMethod","verificationMethod":"did:web:raw.githubusercontent.com:WorldHealthOrganization:tng-participants-dev:main:WHO:signing:DID","jws":"eyJiNjQiOmZhbHNlLCJjcml0IjpbImI2NCJdLCJhbGciOiJFUzI1NiJ9..MEUCIQD0nFk4vSLDWxAIWUgKb1I-FyMvXNjs8ejbjtXeJmvRGAIgIkYvkAEah3D5mMYUWvmix2wZvFKZhqTmH4xq9OK3ctc"}}