{"@context":["https://www.w3.org/ns/did/v1","https://w3id.org/security/suites/jws-2020/v1"],"id":"did:web:worldhealthorganization.github.io:tng-cdn-dev:v2.0.0:trustlist:-:-:DSC:OVRpZDFwYVNHVUU9","controller":"did:web:worldhealthorganization.github.io:tng-cdn-dev:v2.0.0:trustlist:-:-:DSC:OVRpZDFwYVNHVUU9","verificationMethod":[{"id":"did:web:worldhealthorganization.github.io:tng-cdn-dev:v2.0.0:trustlist:-:-:DSC:OVRpZDFwYVNHVUU9","type":"JsonWebKey2020","controller":"did:web:worldhealthorganization.github.io:tng-cdn-dev:v2.0.0:trustlist:-:-:DSC:OVRpZDFwYVNHVUU9","publicKeyJwk":{"kty":"EC","kid":"OVRpZDFwYVNHVUU9","x5c":["MIIC1TCCAnqgAwIBAgIUNiOlzVgWUPMcrD00UfNoJyxuycEwCgYIKoZIzj0EAwIwgYgxCzAJBgNVBAYTAlhPMRUwEwYDVQQIDAxUZXN0IENvdW50cnkxDTALBgNVBAcMBFRlc3QxGjAYBgNVBAoMEVRlc3QgT3JnYW5pc2F0aW9uMRQwEgYDVQQLDAtUTkcgU3VwcG9ydDEhMB8GA1UEAwwYd2hvX2dhdGV3YXlfdGVzdF9UTkdfU0NBMB4XDTI0MDExMTEyMzAzM1oXDTI2MDExMDEyMzAzM1owgYkxCzAJBgNVBAYTAlhPMRUwEwYDVQQIDAxUZXN0IENvdW50cnkxDTALBgNVBAcMBFRlc3QxGjAYBgNVBAoMEVRlc3QgT3JnYW5pc2F0aW9uMRQwEgYDVQQLDAtUTkcgU3VwcG9ydDEiMCAGA1UEAwwZd2hvX2dhdGV3YXlfdGVzdF9UTkdfRFNDMjBZMBMGByqGSM49AgEGCCqGSM49AwEHA0IABDTR4evNHBi4bumKJYskG+AaJ9Mfcr5Sa2LcYKHqp+kfuE3JHpOVA85qURT1BsDSrPWd0g9gXBeYvM3VWlqjW72jgb4wgbswDgYDVR0PAQH/BAQDAgeAMB0GA1UdDgQWBBRa6sydMf+l8SkhgfI00NaolliKtDAfBgNVHSMEGDAWgBR3qC8pHXKu+jM20V8MH+FIIW3ImTA3BgNVHR8EMDAuMCygKqAohiZodHRwOi8vY3JsLndob3Rlc3QuZXhhbXBsZS9DUkwvU0NBLmNybDAwBgNVHSUEKTAnBgsrBgEEAY43j2UBAQYLKwYBBAGON49lAQIGCysGAQQBjjePZQEDMAoGCCqGSM49BAMCA0kAMEYCIQDvXyosqcEte8BcCT4bxQwe54DN0LttzF5HiRFKMMo/fwIhAL0qlBOfWJJS1E14Uf7Zqt1wosBNfVLhtvZJR+5Rv3Me","MIICWDCCAf+gAwIBAgIUUGxSOp7c4Llh2VO50LqW4WQPL2swCgYIKoZIzj0EAwIwgYgxCzAJBgNVBAYTAlhPMRUwEwYDVQQIDAxUZXN0IENvdW50cnkxDTALBgNVBAcMBFRlc3QxGjAYBgNVBAoMEVRlc3QgT3JnYW5pc2F0aW9uMRQwEgYDVQQLDAtUTkcgU3VwcG9ydDEhMB8GA1UEAwwYd2hvX2dhdGV3YXlfdGVzdF9UTkdfU0NBMB4XDTIzMTAyNjEyNTI0OVoXDTI0MTAyNTEyNTI0OVowgYgxCzAJBgNVBAYTAlhPMRUwEwYDVQQIDAxUZXN0IENvdW50cnkxDTALBgNVBAcMBFRlc3QxGjAYBgNVBAoMEVRlc3QgT3JnYW5pc2F0aW9uMRQwEgYDVQQLDAtUTkcgU3VwcG9ydDEhMB8GA1UEAwwYd2hvX2dhdGV3YXlfdGVzdF9UTkdfU0NBMFkwEwYHKoZIzj0CAQYIKoZIzj0DAQcDQgAE3N9mkN8g63a7MijAkg/D5hDkKG28mNwHpQPlGDVkU9eA/dQQYWSyPeTXlDA6jrpGaX7C5klOnWVyA5sRoisjmqNFMEMwEgYDVR0TAQH/BAgwBgEB/wIBADAOBgNVHQ8BAf8EBAMCAQYwHQYDVR0OBBYEFHeoLykdcq76MzbRXwwf4UghbciZMAoGCCqGSM49BAMCA0cAMEQCIDwt1QegIuyHq8QxLVL4B6g5RlEqgbjYVP1+mDbsTH9NAiBA3b6Geg7kNSa+tZFrmp5yL5plgAHF4u+SPnOnfoF2FA=="],"crv":"P-256","x":"NNHh680cGLhu6YoliyQb4Bon0x9yvlJrYtxgoeqn6R8","y":"ALhNyR6TlQPOalEU9QbA0qz1ndIPYFwXmLzN1Vpao1u9"}}],"proof":{"type":"JsonWebSignature2020","created":"2024-09-27T15:36:16Z","nonce":"p9e7YOxtRHBO6GlWFaxOneHFoFzCJGsk","proofPurpose":"assertionMethod","verificationMethod":"did:web:raw.githubusercontent.com:WorldHealthOrganization:tng-participants-dev:main:WHO:signing:DID","jws":"eyJiNjQiOmZhbHNlLCJjcml0IjpbImI2NCJdLCJhbGciOiJFUzI1NiJ9..MEQCIFwx7NoFP_mC0a2zkF0VmHaZonqAOb3FNhN3KFokytRSAiAaIKuSXhWxyZzUc7MD6P6J5EV66zqfcWDTMYLBKiXrDQ"}}