{"@context":["https://www.w3.org/ns/did/v1","https://w3id.org/security/suites/jws-2020/v1"],"id":"did:web:worldhealthorganization.github.io:tng-cdn-dev:v2.0.0:trustlist:-:-:SCA:bUF2YWdpSkFZMzQ9","controller":"did:web:worldhealthorganization.github.io:tng-cdn-dev:v2.0.0:trustlist:-:-:SCA:bUF2YWdpSkFZMzQ9","verificationMethod":[{"id":"did:web:worldhealthorganization.github.io:tng-cdn-dev:v2.0.0:trustlist:-:-:SCA:bUF2YWdpSkFZMzQ9#bUF2YWdpSkFZMzQ9","type":"JsonWebKey2020","controller":"did:web:worldhealthorganization.github.io:tng-cdn-dev:v2.0.0:trustlist:-:-:SCA:bUF2YWdpSkFZMzQ9","publicKeyJwk":{"kty":"EC","kid":"bUF2YWdpSkFZMzQ9","x5c":["MIICPzCCAeWgAwIBAgIUDY1QW114xRFLu6EvEXb/P+fFUhkwCgYIKoZIzj0EAwIwfDELMAkGA1UEBhMCQloxDzANBgNVBAgMBkJlbGl6ZTEdMBsGA1UEBwwUTEFDUGFzcyBDb25uZWN0YXRob24xDDAKBgNVBAoMA1dITzEMMAoGA1UECwwDUiZEMSEwHwYDVQQDDBhMQUNQYXNzIENvbm5lY3RhdGhvbiBUTkcwHhcNMjMxMDI1MTQwNTM4WhcNMjcxMDI1MTQwNTM4WjB8MQswCQYDVQQGEwJCWjEPMA0GA1UECAwGQmVsaXplMR0wGwYDVQQHDBRMQUNQYXNzIENvbm5lY3RhdGhvbjEMMAoGA1UECgwDV0hPMQwwCgYDVQQLDANSJkQxITAfBgNVBAMMGExBQ1Bhc3MgQ29ubmVjdGF0aG9uIFRORzBZMBMGByqGSM49AgEGCCqGSM49AwEHA0IABAo6eHtdYaQZkI4k9T+ZXZ6+3KoKYFx0vERJi0NBUZ50r5mU5Np/UuuUcU5e88y0CcJyHNJqaeyB8WYd3W/e4B2jRTBDMBIGA1UdEwEB/wQIMAYBAf8CAQAwDgYDVR0PAQH/BAQDAgEGMB0GA1UdDgQWBBTWPtWDolt9MvkT/Jd7AdbPu6qBhTAKBggqhkjOPQQDAgNIADBFAiEA4bOlVvOOUdZ9fAbMyxClqEPtYfBes4T49RbwtukJH2ACIG6UA8AqxFwKeyHR/K8NfpnFpmtfocv6FwWdaGmb6Hhc"],"crv":"P-256","x":"Cjp4e11hpBmQjiT1P5ldnr7cqgpgXHS8REmLQ0FRnnQ","y":"AK-ZlOTaf1LrlHFOXvPMtAnCchzSamnsgfFmHd1v3uAd"}}],"proof":{"type":"JsonWebSignature2020","created":"2024-08-09T12:00:33Z","nonce":"XRSrQZusRBlPFKQLOrSzjO4cgsMAeVee","proofPurpose":"assertionMethod","verificationMethod":"did:web:raw.githubusercontent.com:WorldHealthOrganization:tng-participants-dev:main:WHO:signing:DID","jws":"eyJiNjQiOmZhbHNlLCJjcml0IjpbImI2NCJdLCJhbGciOiJFUzI1NiJ9..MEYCIQDXS2leSLfHdMoeWe6eTYKHbPCuVFpIrYLDW5H8lVeyKQIhAPiP1iHcf-T0WV2jocEZMC-swoZqy2Szct5gE88-B6c6"}}