{"@context":["https://www.w3.org/ns/did/v1","https://w3id.org/security/suites/jws-2020/v1"],"id":"did:web:worldhealthorganization.github.io:tng-cdn-dev:v2.0.0:trustlist:PH4H:SUR:SCA","controller":"did:web:worldhealthorganization.github.io:tng-cdn-dev:v2.0.0:trustlist:PH4H:SUR","verificationMethod":[{"id":"did:web:worldhealthorganization.github.io:tng-cdn-dev:v2.0.0:trustlist:PH4H:SUR:SCA#MVV2MzdWUFNNaHM9","type":"JsonWebKey2020","controller":"did:web:worldhealthorganization.github.io:tng-cdn-dev:v2.0.0:trustlist:PH4H:SUR","publicKeyJwk":{"kty":"EC","kid":"MVV2MzdWUFNNaHM9","x5c":["MIICCDCCAa+gAwIBAgIUDW6MLzTAAnYn+diJPr5dvVdQfz0wCgYIKoZIzj0EAwIwYTELMAkGA1UEBhMCU1IxETAPBgNVBAgMCFN1cmluYW1lMRMwEQYDVQQHDApQYXJhbWFyaWJvMQwwCgYDVQQKDANNT0gxDDAKBgNVBAsMA1ImRDEOMAwGA1UEAwwFTU9IU1IwHhcNMjQxMDA2MDk0MDU4WhcNMjgxMDA2MDk0MDU4WjBhMQswCQYDVQQGEwJTUjERMA8GA1UECAwIU3VyaW5hbWUxEzARBgNVBAcMClBhcmFtYXJpYm8xDDAKBgNVBAoMA01PSDEMMAoGA1UECwwDUiZEMQ4wDAYDVQQDDAVNT0hTUjBZMBMGByqGSM49AgEGCCqGSM49AwEHA0IABOevFSQLQXrckPR/E9IG6JjkNIn9ZXBRQyABq+mcmZdnl1LrQC/q4SBQMk+GSbgsQlFgDeG7i2YdelLYGPKxC3mjRTBDMBIGA1UdEwEB/wQIMAYBAf8CAQAwDgYDVR0PAQH/BAQDAgEGMB0GA1UdDgQWBBTylViw0Ntr2J1PQt1qDJGRZkuuNzAKBggqhkjOPQQDAgNHADBEAiAZqQTEni9QnL/yGJWjY8lWCefayxjfKYs52Dk7GAlRvAIgBbCfwaafXTw1eDsEwrnQUAKcigkWuK82FrOPUpq/WCw="],"crv":"P-256","x":"AOevFSQLQXrckPR_E9IG6JjkNIn9ZXBRQyABq-mcmZdn","y":"AJdS60Av6uEgUDJPhkm4LEJRYA3hu4tmHXpS2BjysQt5"}}],"proof":{"type":"JsonWebSignature2020","created":"2024-10-24T12:00:18Z","nonce":"3c5REuQE3KB9bqFvJCmTMHD9w9lFhbaI","proofPurpose":"assertionMethod","verificationMethod":"did:web:raw.githubusercontent.com:WorldHealthOrganization:tng-participants-dev:main:WHO:signing:DID","jws":"eyJiNjQiOmZhbHNlLCJjcml0IjpbImI2NCJdLCJhbGciOiJFUzI1NiJ9..MEUCIEBqz5k0lDM6go1ZUG2uABV2FPdIQUEXPhr0KzQdczz5AiEA0bUGlciMcKekGOr6HekCHAQKGN6kqDRELz21bkUx02I"}}