{"@context":["https://www.w3.org/ns/did/v1","https://w3id.org/security/suites/jws-2020/v1"],"id":"did:web:worldhealthorganization.github.io:tng-cdn-dev:v2.0.0:trustlist:-:-:DSC:TkpUVlNrWVJlMFU9","controller":"did:web:worldhealthorganization.github.io:tng-cdn-dev:v2.0.0:trustlist:-:-:DSC:TkpUVlNrWVJlMFU9","verificationMethod":[{"id":"did:web:worldhealthorganization.github.io:tng-cdn-dev:v2.0.0:trustlist:-:-:DSC:TkpUVlNrWVJlMFU9","type":"JsonWebKey2020","controller":"did:web:worldhealthorganization.github.io:tng-cdn-dev:v2.0.0:trustlist:-:-:DSC:TkpUVlNrWVJlMFU9","publicKeyJwk":{"kty":"EC","kid":"TkpUVlNrWVJlMFU9","x5c":["MIICozCCAkigAwIBAgIUG1Ay1W9dEc/KYJwp09FOYGsiF08wCgYIKoZIzj0EAwIwaDELMAkGA1UEBhMCWEMxEzARBgNVBAgMClRlc3QgU3RhdGUxDTALBgNVBAcMBFRFU1QxDDAKBgNVBAoMA1dITzEMMAoGA1UECwwDUk5EMRkwFwYDVQQDDBBOYXRpb25YQ19UTlBfVExTMB4XDTI0MDgwNzEyMDc1N1oXDTI2MDgwNzEyMDc1N1owczELMAkGA1UEBhMCWEMxEzARBgNVBAgMClRlc3QgU3RhdGUxDTALBgNVBAcMBFRFU1QxDDAKBgNVBAoMA1dITzEMMAoGA1UECwwDUk5EMSQwIgYDVQQDDBtIZWFsdGggQWRtaW5pc3RyYXRpb24gb2YgWEMwWTATBgcqhkjOPQIBBggqhkjOPQMBBwNCAATiehBoy/Ojw1TnlsHUNIgSERdkRrsjI1GU8BmP2WIm82tV3t7TcmShhLdaHtoJKfvqHWPam0qSmLHPyR8NTh3Po4HEMIHBMA4GA1UdDwEB/wQEAwIHgDAdBgNVHQ4EFgQURaI20NVTXtrxGBhIhug5C4nP3mkwHwYDVR0jBBgwFoAUn5zGsbBkJZnIttUc4gUCmxysCSEwPQYDVR0fBDYwNDAyoDCgLoYsaHR0cDovL2NybC5leGFtcGxlZG9tYWluLmV4YW1wbGUvQ1JML1NDQS5jcmwwMAYDVR0lBCkwJwYLKwYBBAGON49lAQEGCysGAQQBjjePZQECBgsrBgEEAY43j2UBAzAKBggqhkjOPQQDAgNJADBGAiEA6rGv8eqy7usdPbLIBSlYRIPx+CeVsjgJq4F0nDHlHMECIQDnwspWFxHSQg9AtmF3TzCBUGRB1IDm89AEGkSUagK7aA==","MIICFjCCAb2gAwIBAgIUAMNc2NPsNElpa7Imh5DNmkrgKuQwCgYIKoZIzj0EAwIwaDELMAkGA1UEBhMCWEMxEzARBgNVBAgMClRlc3QgU3RhdGUxDTALBgNVBAcMBFRFU1QxDDAKBgNVBAoMA1dITzEMMAoGA1UECwwDUk5EMRkwFwYDVQQDDBBOYXRpb25YQ19UTlBfVExTMB4XDTI0MDczMDEwMTQyNVoXDTI4MDczMDEwMTQyNVowaDELMAkGA1UEBhMCWEMxEzARBgNVBAgMClRlc3QgU3RhdGUxDTALBgNVBAcMBFRFU1QxDDAKBgNVBAoMA1dITzEMMAoGA1UECwwDUk5EMRkwFwYDVQQDDBBOYXRpb25YQ19UTlBfVExTMFkwEwYHKoZIzj0CAQYIKoZIzj0DAQcDQgAEGlOKN13IE/IKeisOIOe9uNDhGoKoIYsjChlrZ433XPSkzQ6974J2qpXLMXtnYzSs7oEiDPTzEsabr+KpJMmph6NFMEMwEgYDVR0TAQH/BAgwBgEB/wIBADAOBgNVHQ8BAf8EBAMCAQYwHQYDVR0OBBYEFJ+cxrGwZCWZyLbVHOIFApscrAkhMAoGCCqGSM49BAMCA0cAMEQCIGlMDxYmCun5EnHJTyQd9Y0Se/qm+qOhVHIkXecqyE7dAiATArofdaQkqf28VCUyrpNtTGeLh4CSsdONYNSfQoDSlA=="],"crv":"P-256","x":"AOJ6EGjL86PDVOeWwdQ0iBIRF2RGuyMjUZTwGY_ZYibz","y":"a1Xe3tNyZKGEt1oe2gkp--odY9qbSpKYsc_JHw1OHc8"}}],"proof":{"type":"JsonWebSignature2020","created":"2024-09-27T15:36:16Z","nonce":"VpVreRlUjHxPtePZNzvwJuVfHBaiyxrU","proofPurpose":"assertionMethod","verificationMethod":"did:web:raw.githubusercontent.com:WorldHealthOrganization:tng-participants-dev:main:WHO:signing:DID","jws":"eyJiNjQiOmZhbHNlLCJjcml0IjpbImI2NCJdLCJhbGciOiJFUzI1NiJ9..MEYCIQDOpsEdq5gi0fUgVj8axKJ2YzjfwLMdcj2u2sHuDSCfnwIhAOMIsXdPaRu1VcwJPkZ2vmHHWIR-i9nLwH3edYUishE6"}}