{"@context":["https://www.w3.org/ns/did/v1","https://w3id.org/security/suites/jws-2020/v1"],"id":"did:web:worldhealthorganization.github.io:tng-cdn-dev:v2.0.0:trustlist:DCC:XM","controller":"did:web:worldhealthorganization.github.io:tng-cdn-dev:v2.0.0:trustlist:DCC:XM","verificationMethod":[{"id":"did:web:worldhealthorganization.github.io:tng-cdn-dev:v2.0.0:trustlist:DCC:XM:SCA:RkUwMU1kd2oxR0k9","type":"JsonWebKey2020","controller":"did:web:worldhealthorganization.github.io:tng-cdn-dev:v2.0.0:trustlist:DCC:XM","publicKeyJwk":{"kty":"EC","kid":"RkUwMU1kd2oxR0k9","x5c":["MIICJjCCAcugAwIBAgIUFp+6rrxKRU7YBf7fYaZv4r5T1yowCgYIKoZIzj0EAwIwbzELMAkGA1UEBhMCWE0xFjAUBgNVBAgMDVRlc3QgTWFsYXlzaWExETAPBgNVBAcMCE1hbGF5c2lhMQwwCgYDVQQKDANXSE8xDDAKBgNVBAsMA1ImRDEZMBcGA1UEAwwQTmF0aW9uWEFfVE5QX1NDQTAeFw0yNDA3MTAxMDQzNDJaFw0yODA3MTAxMDQzNDJaMG8xCzAJBgNVBAYTAlhNMRYwFAYDVQQIDA1UZXN0IE1hbGF5c2lhMREwDwYDVQQHDAhNYWxheXNpYTEMMAoGA1UECgwDV0hPMQwwCgYDVQQLDANSJkQxGTAXBgNVBAMMEE5hdGlvblhBX1ROUF9TQ0EwWTATBgcqhkjOPQIBBggqhkjOPQMBBwNCAASP/HwEKQ1y3nMd2Wg9oqktl5FORXa8pzEAOH9etbQUUlxsDkWa8HrRW7D/Jg0UwHfG4owQ0cdsbkV2gBH0bTCCo0UwQzASBgNVHRMBAf8ECDAGAQH/AgEAMA4GA1UdDwEB/wQEAwIBBjAdBgNVHQ4EFgQUYQT498xirHOreNt2GJXdoIResMQwCgYIKoZIzj0EAwIDSQAwRgIhAPoVukN4OFiBYuqWK49v2UUjayWRhffdl90qnmQyf2H6AiEAn1QyOxbPBHGAosdcPqQUU9I5l37tpUiETakr6c1NgrI="],"crv":"P-256","x":"AI_8fAQpDXLecx3ZaD2iqS2XkU5FdrynMQA4f161tBRS","y":"XGwORZrwetFbsP8mDRTAd8bijBDRx2xuRXaAEfRtMII"}},{"id":"did:web:worldhealthorganization.github.io:tng-cdn-dev:v2.0.0:trustlist:DCC:XM:DSC:cWI0TDBhdGlYLzQ9","type":"JsonWebKey2020","controller":"did:web:worldhealthorganization.github.io:tng-cdn-dev:v2.0.0:trustlist:DCC:XM","publicKeyJwk":{"kty":"EC","kid":"cWI0TDBhdGlYLzQ9","x5c":["MIICvTCCAmKgAwIBAgIUXgwhcghxumxc7gH0W4CCnDPECdYwCgYIKoZIzj0EAwIwbzELMAkGA1UEBhMCWE0xFjAUBgNVBAgMDVRlc3QgTWFsYXlzaWExETAPBgNVBAcMCE1hbGF5c2lhMQwwCgYDVQQKDANXSE8xDDAKBgNVBAsMA1ImRDEZMBcGA1UEAwwQTmF0aW9uWEFfVE5QX1NDQTAeFw0yNDA3MjIwOTM5NTRaFw0yNjA3MjIwOTM5NTRaMIGRMQswCQYDVQQGEwJYTTEWMBQGA1UECAwNVGVzdCBNYWxheXNpYTERMA8GA1UEBwwITWFsYXlzaWExDDAKBgNVBAoMA1dITzEMMAoGA1UECwwDUiZEMRkwFwYDVQQDDBBOYXRpb25YQV9UTlBfVExTMSAwHgYJKoZIhvcNAQkBFhF1ZGF5YS5tQGVudG9tby5jbzBZMBMGByqGSM49AgEGCCqGSM49AwEHA0IABFWAqJm3oEsj4/9E1g8i6ZPP+fScCmdhf7qgXLFM4byFg8YEbLDyGXtA9YNE+Ot4bNCdohqaIaeO9QNcLTLRKZOjgbgwgbUwDgYDVR0PAQH/BAQDAgeAMB0GA1UdDgQWBBRVsjoxsn4tCWKjW3v+ko8wU7EdyjAfBgNVHSMEGDAWgBRhBPj3zGKsc6t423YYld2ghF6wxDAxBgNVHR8EKjAoMCagJKAihiBodHRwOi8vY3JsLmVudG9tby5jby9DUkwvU0NBLmNybDAwBgNVHSUEKTAnBgsrBgEEAY43j2UBAQYLKwYBBAGON49lAQIGCysGAQQBjjePZQEDMAoGCCqGSM49BAMCA0kAMEYCIQCX4IeTHigwXiXNSvPobVW6u3DsVw7fiUyE3WWYmzKWJQIhALdyqylYjRvjavZYwfimagtdOBTLCsE9Nr+KWbq5Eex+","MIICJjCCAcugAwIBAgIUFp+6rrxKRU7YBf7fYaZv4r5T1yowCgYIKoZIzj0EAwIwbzELMAkGA1UEBhMCWE0xFjAUBgNVBAgMDVRlc3QgTWFsYXlzaWExETAPBgNVBAcMCE1hbGF5c2lhMQwwCgYDVQQKDANXSE8xDDAKBgNVBAsMA1ImRDEZMBcGA1UEAwwQTmF0aW9uWEFfVE5QX1NDQTAeFw0yNDA3MTAxMDQzNDJaFw0yODA3MTAxMDQzNDJaMG8xCzAJBgNVBAYTAlhNMRYwFAYDVQQIDA1UZXN0IE1hbGF5c2lhMREwDwYDVQQHDAhNYWxheXNpYTEMMAoGA1UECgwDV0hPMQwwCgYDVQQLDANSJkQxGTAXBgNVBAMMEE5hdGlvblhBX1ROUF9TQ0EwWTATBgcqhkjOPQIBBggqhkjOPQMBBwNCAASP/HwEKQ1y3nMd2Wg9oqktl5FORXa8pzEAOH9etbQUUlxsDkWa8HrRW7D/Jg0UwHfG4owQ0cdsbkV2gBH0bTCCo0UwQzASBgNVHRMBAf8ECDAGAQH/AgEAMA4GA1UdDwEB/wQEAwIBBjAdBgNVHQ4EFgQUYQT498xirHOreNt2GJXdoIResMQwCgYIKoZIzj0EAwIDSQAwRgIhAPoVukN4OFiBYuqWK49v2UUjayWRhffdl90qnmQyf2H6AiEAn1QyOxbPBHGAosdcPqQUU9I5l37tpUiETakr6c1NgrI="],"crv":"P-256","x":"VYCombegSyPj_0TWDyLpk8_59JwKZ2F_uqBcsUzhvIU","y":"AIPGBGyw8hl7QPWDRPjreGzQnaIamiGnjvUDXC0y0SmT"}}],"proof":{"type":"JsonWebSignature2020","created":"2024-10-07T06:00:03Z","nonce":"NUks7wKcM9XnMUkteOsTQEf5zOg45kD4","proofPurpose":"assertionMethod","verificationMethod":"did:web:raw.githubusercontent.com:WorldHealthOrganization:tng-participants-dev:main:WHO:signing:DID","jws":"eyJiNjQiOmZhbHNlLCJjcml0IjpbImI2NCJdLCJhbGciOiJFUzI1NiJ9..MEQCIGyheH8D4yvQlaAZEW6IjqEJeFNWocym-2kBn1KX9zZAAiBb-dfDveyeyilrfubeH_wgXZ-rBFy3VyGeK7w9FenVZw"}}