{"@context":["https://www.w3.org/ns/did/v1","https://w3id.org/security/suites/jws-2020/v1"],"id":"did:web:worldhealthorganization.github.io:tng-cdn-dev:v2.0.0:trustlist:-:BRB:SCA","controller":"did:web:worldhealthorganization.github.io:tng-cdn-dev:v2.0.0:trustlist:-:BRB","verificationMethod":[{"id":"did:web:worldhealthorganization.github.io:tng-cdn-dev:v2.0.0:trustlist:-:BRB:SCA#U2ZyTWhnU2YzVTg9","type":"JsonWebKey2020","controller":"did:web:worldhealthorganization.github.io:tng-cdn-dev:v2.0.0:trustlist:-:BRB","publicKeyJwk":{"kty":"EC","kid":"U2ZyTWhnU2YzVTg9","x5c":["MIICGzCCAcGgAwIBAgIUJxLxUF/q985Qv0ZhDMlkL69qRYYwCgYIKoZIzj0EAwIwajELMAkGA1UEBhMCQkIxEzARBgNVBAgMClRlc3QgU3RhdGUxDzANBgNVBAcMBkdlbmV2YTEMMAoGA1UECgwDV0hPMQwwCgYDVQQLDANSJkQxGTAXBgNVBAMMEE5hdGlvblhBX1ROUF9TQ0EwHhcNMjQxMDEwMTMxNjU3WhcNMjgxMDEwMTMxNjU3WjBqMQswCQYDVQQGEwJCQjETMBEGA1UECAwKVGVzdCBTdGF0ZTEPMA0GA1UEBwwGR2VuZXZhMQwwCgYDVQQKDANXSE8xDDAKBgNVBAsMA1ImRDEZMBcGA1UEAwwQTmF0aW9uWEFfVE5QX1NDQTBZMBMGByqGSM49AgEGCCqGSM49AwEHA0IABPuLEWSwd10bfdrMrqu8NpoBxdoANJ9jKbDDdsOIy8cLvdEoO4HHMJSPVphcz7aSEEUKQZW0Hs+rZsbbCa1RcimjRTBDMBIGA1UdEwEB/wQIMAYBAf8CAQAwDgYDVR0PAQH/BAQDAgEGMB0GA1UdDgQWBBQvfTiezqh099OJDcbo4hWaCezxQTAKBggqhkjOPQQDAgNIADBFAiEAtHp2fCtIuuQRaJNce2MZcEtiQp9nZptd1V+HZ+dTL38CIAjVAeOYnxthwCGvEIB65wctzono0SFRfOEV91t5fOHW"],"crv":"P-256","x":"APuLEWSwd10bfdrMrqu8NpoBxdoANJ9jKbDDdsOIy8cL","y":"AL3RKDuBxzCUj1aYXM-2khBFCkGVtB7Pq2bG2wmtUXIp"}}],"proof":{"type":"JsonWebSignature2020","created":"2024-10-24T12:00:19Z","nonce":"mOtzZUyEFyVGRiQxykFrkBgxMfTUnrv1","proofPurpose":"assertionMethod","verificationMethod":"did:web:raw.githubusercontent.com:WorldHealthOrganization:tng-participants-dev:main:WHO:signing:DID","jws":"eyJiNjQiOmZhbHNlLCJjcml0IjpbImI2NCJdLCJhbGciOiJFUzI1NiJ9..MEYCIQCaIbEuxS8UZ8FJRStt8yeUZM8_IYVWVj1pcO0hHHzuigIhAKUh9-LDkWFSIOp7kaADln_dgjLSu-SckSfuzDe1vbr7"}}