{"@context":["https://www.w3.org/ns/did/v1","https://w3id.org/security/suites/jws-2020/v1"],"id":"did:web:worldhealthorganization.github.io:tng-cdn-dev:v2.0.0:trustlist:RACSEL-DDVC:-:SCA:SHVsWmlhUHRNVE09","controller":"did:web:worldhealthorganization.github.io:tng-cdn-dev:v2.0.0:trustlist:RACSEL-DDVC:-:SCA:SHVsWmlhUHRNVE09","verificationMethod":[{"id":"did:web:worldhealthorganization.github.io:tng-cdn-dev:v2.0.0:trustlist:RACSEL-DDVC:-:SCA:SHVsWmlhUHRNVE09#SHVsWmlhUHRNVE09","type":"JsonWebKey2020","controller":"did:web:worldhealthorganization.github.io:tng-cdn-dev:v2.0.0:trustlist:RACSEL-DDVC:-:SCA:SHVsWmlhUHRNVE09","publicKeyJwk":{"kty":"EC","kid":"SHVsWmlhUHRNVE09","x5c":["MIICQzCCAemgAwIBAgIURbZ2pY+DJEsAFgs+TNQ+NuhkGakwCgYIKoZIzj0EAwIwfjELMAkGA1UEBhMCUFkxETAPBgNVBAgMCFBhcmFndWF5MR0wGwYDVQQHDBRMQUNQYXNzIENvbm5lY3RhdGhvbjEMMAoGA1UECgwDV0hPMQwwCgYDVQQLDANSJkQxITAfBgNVBAMMGExBQ1Bhc3MgQ29ubmVjdGF0aG9uIFRORzAeFw0yMzEwMjUxNDA4MjNaFw0yNzEwMjUxNDA4MjNaMH4xCzAJBgNVBAYTAlBZMREwDwYDVQQIDAhQYXJhZ3VheTEdMBsGA1UEBwwUTEFDUGFzcyBDb25uZWN0YXRob24xDDAKBgNVBAoMA1dITzEMMAoGA1UECwwDUiZEMSEwHwYDVQQDDBhMQUNQYXNzIENvbm5lY3RhdGhvbiBUTkcwWTATBgcqhkjOPQIBBggqhkjOPQMBBwNCAAR8cxrcsdNfwyOTgsPQDjSEaUY2FqJeZ5pgVlMY3zKvvbM1d8xD1hRBLIxLKHIZnOzon9jf6lrkq5GmTXCSVAJGo0UwQzASBgNVHRMBAf8ECDAGAQH/AgEAMA4GA1UdDwEB/wQEAwIBBjAdBgNVHQ4EFgQUhFoev7FDANIaqtzlP3CXyj7F9jEwCgYIKoZIzj0EAwIDSAAwRQIhAL5r63+4Lr1Pp9/UZPB2k3k1qNuR9eGHQCK4JbBMdnxQAiAU6V2Fcam4rJSX0BAuFmDeCTpw0EcUtvPnUF8YiP1I8w=="],"crv":"P-256","x":"fHMa3LHTX8Mjk4LD0A40hGlGNhaiXmeaYFZTGN8yr70","y":"ALM1d8xD1hRBLIxLKHIZnOzon9jf6lrkq5GmTXCSVAJG"}}],"proof":{"type":"JsonWebSignature2020","created":"2024-08-09T12:00:31Z","nonce":"3ENJgHuCpVjk06QUCG5uEces9StnxruW","proofPurpose":"assertionMethod","verificationMethod":"did:web:raw.githubusercontent.com:WorldHealthOrganization:tng-participants-dev:main:WHO:signing:DID","jws":"eyJiNjQiOmZhbHNlLCJjcml0IjpbImI2NCJdLCJhbGciOiJFUzI1NiJ9..MEUCIHEmBK3t97UttLmoRJPzsxXCE5IXpcUpYQ_IoDdH31VpAiEAv2iqe456nyh4e-9ufm-IETaxUBCKuHGSoCOgOvScgKM"}}