{"@context":["https://www.w3.org/ns/did/v1","https://w3id.org/security/suites/jws-2020/v1"],"id":"did:web:worldhealthorganization.github.io:tng-cdn-dev:v2.0.0:trustlist:RACSEL-DDVC:-:SCA:aU90WjdscnlOSzQ9","controller":"did:web:worldhealthorganization.github.io:tng-cdn-dev:v2.0.0:trustlist:RACSEL-DDVC:-:SCA:aU90WjdscnlOSzQ9","verificationMethod":[{"id":"did:web:worldhealthorganization.github.io:tng-cdn-dev:v2.0.0:trustlist:RACSEL-DDVC:-:SCA:aU90WjdscnlOSzQ9#aU90WjdscnlOSzQ9","type":"JsonWebKey2020","controller":"did:web:worldhealthorganization.github.io:tng-cdn-dev:v2.0.0:trustlist:RACSEL-DDVC:-:SCA:aU90WjdscnlOSzQ9","publicKeyJwk":{"kty":"EC","kid":"aU90WjdscnlOSzQ9","x5c":["MIICQzCCAeigAwIBAgITMT3aDM6wHnRVa/qYhSFi+Z4z9jAKBggqhkjOPQQDAjB+MQswCQYDVQQGEwJDTzERMA8GA1UECAwIQ29sb21iaWExHTAbBgNVBAcMFExBQ1Bhc3MgQ29ubmVjdGF0aG9uMQwwCgYDVQQKDANXSE8xDDAKBgNVBAsMA1ImRDEhMB8GA1UEAwwYTEFDUGFzcyBDb25uZWN0YXRob24gVE5HMB4XDTIzMTAyNTE0MDYzNFoXDTI3MTAyNTE0MDYzNFowfjELMAkGA1UEBhMCQ08xETAPBgNVBAgMCENvbG9tYmlhMR0wGwYDVQQHDBRMQUNQYXNzIENvbm5lY3RhdGhvbjEMMAoGA1UECgwDV0hPMQwwCgYDVQQLDANSJkQxITAfBgNVBAMMGExBQ1Bhc3MgQ29ubmVjdGF0aG9uIFRORzBZMBMGByqGSM49AgEGCCqGSM49AwEHA0IABGclboEVj3rKFrhuGOc0YG2BRrMl00pLEOv5H+xkOQOx9ae49I8EkuvpxcvsEBtNTiWVISMzWqy0PBEClteeL0SjRTBDMBIGA1UdEwEB/wQIMAYBAf8CAQAwDgYDVR0PAQH/BAQDAgEGMB0GA1UdDgQWBBRSIk38j5qA2fXbOUhrTlq96TQV4DAKBggqhkjOPQQDAgNJADBGAiEA3BoWH4J0BFIi1DdpWNutsp7Swm/hwxnHehArou9LnHICIQDtR2LrJ5ga5TCY1itYBGsr+vRa9WnyM2HWdeUz5DaSZw=="],"crv":"P-256","x":"ZyVugRWPesoWuG4Y5zRgbYFGsyXTSksQ6_kf7GQ5A7E","y":"APWnuPSPBJLr6cXL7BAbTU4llSEjM1qstDwRApbXni9E"}}],"proof":{"type":"JsonWebSignature2020","created":"2024-08-09T12:00:31Z","nonce":"E3g1Bh1P5zbrfowkT4g9HzwkXQEPfVX6","proofPurpose":"assertionMethod","verificationMethod":"did:web:raw.githubusercontent.com:WorldHealthOrganization:tng-participants-dev:main:WHO:signing:DID","jws":"eyJiNjQiOmZhbHNlLCJjcml0IjpbImI2NCJdLCJhbGciOiJFUzI1NiJ9..MEYCIQCxCAFamT17lbBezypHE4dIvaqCYO8gB0ARp8unNJeVbgIhAK89axtY49MadbFSD82tYXZLp8TC9x3zjp1n05oS875n"}}